"Time","Length","Info"
"0.000000","1434","443  >  51405 [ACK] Seq=1 Ack=1 Win=501 Len=1380 [TCP segment of a reassembled PDU]"
"0.000260","110","Application Data"
"0.166368","1434","443  >  51405 [ACK] Seq=1437 Ack=1 Win=501 Len=1380 [TCP segment of a reassembled PDU]"
"0.166373","110","Application Data"
"0.311920","1434","443  >  51405 [ACK] Seq=2873 Ack=1 Win=501 Len=1380 [TCP segment of a reassembled PDU]"
"0.312087","110","Application Data"
"0.474914","1434","443  >  51405 [ACK] Seq=4309 Ack=1 Win=501 Len=1380 [TCP segment of a reassembled PDU]"
"0.475093","110","Application Data"
"0.673397","1434","443  >  51405 [ACK] Seq=5745 Ack=1 Win=501 Len=1380 [TCP segment of a reassembled PDU]"
"0.674037","110","Application Data"
"0.872385","1434","443  >  51405 [ACK] Seq=7181 Ack=1 Win=501 Len=1380 [TCP segment of a reassembled PDU]"
"0.872553","110","Application Data"
"1.034648","1434","443  >  51405 [ACK] Seq=8617 Ack=1 Win=501 Len=1380 [TCP segment of a reassembled PDU]"
"1.034649","110","Application Data"
"1.214969","1434","443  >  51405 [ACK] Seq=10053 Ack=1 Win=501 Len=1380 [TCP segment of a reassembled PDU]"
"1.214971","110","Application Data"
"1.357897","1434","443  >  51405 [ACK] Seq=11489 Ack=1 Win=501 Len=1380 [TCP segment of a reassembled PDU]"
"1.358073","110","Application Data"
"1.555152","1434","443  >  51405 [ACK] Seq=12925 Ack=1 Win=501 Len=1380 [TCP segment of a reassembled PDU]"
"1.555153","110","Application Data"
"1.755680","1434","443  >  51405 [ACK] Seq=14361 Ack=1 Win=501 Len=1380 [TCP segment of a reassembled PDU]"
"1.755681","110","Application Data"
"1.914656","1434","443  >  51405 [ACK] Seq=15797 Ack=1 Win=501 Len=1380 [TCP segment of a reassembled PDU]"
"1.914790","110","Application Data"
"2.075400","1434","443  >  51405 [ACK] Seq=17233 Ack=1 Win=501 Len=1380 [TCP segment of a reassembled PDU]"
"2.075401","110","Application Data"
"2.273160","1434","443  >  51405 [ACK] Seq=18669 Ack=1 Win=501 Len=1380 [TCP segment of a reassembled PDU]"
"2.273161","110","Application Data"
"2.432085","1434","443  >  51405 [ACK] Seq=20105 Ack=1 Win=501 Len=1380 [TCP segment of a reassembled PDU]"
"2.432086","110","Application Data"
"2.640002","1434","443  >  51405 [ACK] Seq=21541 Ack=1 Win=501 Len=1380 [TCP segment of a reassembled PDU]"
"2.640357","110","Application Data"
"2.766882","1434","443  >  51405 [ACK] Seq=22977 Ack=1 Win=501 Len=1380 [TCP segment of a reassembled PDU]"
"2.768655","110","Application Data"
"2.956279","1434","443  >  51405 [ACK] Seq=24413 Ack=1 Win=501 Len=1380 [TCP segment of a reassembled PDU]"
"2.956448","110","Application Data"
"3.155006","1434","443  >  51405 [ACK] Seq=25849 Ack=1 Win=501 Len=1380 [TCP segment of a reassembled PDU]"
"3.155204","110","Application Data"
"3.313787","1434","443  >  51405 [ACK] Seq=27285 Ack=1 Win=501 Len=1380 [TCP segment of a reassembled PDU]"
"3.313957","110","Application Data"
"3.513558","1434","443  >  51405 [ACK] Seq=28721 Ack=1 Win=501 Len=1380 [TCP segment of a reassembled PDU]"
"3.513816","110","Application Data"
"3.637300","1434","443  >  51405 [ACK] Seq=30157 Ack=1 Win=501 Len=1380 [TCP segment of a reassembled PDU]"
"3.637301","110","Application Data"
"3.831882","1434","443  >  51405 [ACK] Seq=31593 Ack=1 Win=501 Len=1380 [TCP segment of a reassembled PDU]"
"3.832153","110","Application Data"
"4.028971","1434","443  >  51405 [ACK] Seq=33029 Ack=1 Win=501 Len=1380 [TCP segment of a reassembled PDU]"
"4.028972","110","Application Data"
"4.190836","1434","443  >  51405 [ACK] Seq=34465 Ack=1 Win=501 Len=1380 [TCP segment of a reassembled PDU]"
"4.190840","110","Application Data"
"4.348579","1434","443  >  51405 [ACK] Seq=35901 Ack=1 Win=501 Len=1380 [TCP segment of a reassembled PDU]"
"4.349180","110","Application Data"
"4.514764","1434","443  >  51405 [ACK] Seq=37337 Ack=1 Win=501 Len=1380 [TCP segment of a reassembled PDU]"
"4.514911","110","Application Data"
"4.725353","1434","443  >  51405 [ACK] Seq=38773 Ack=1 Win=501 Len=1380 [TCP segment of a reassembled PDU]"
"4.725354","110","Application Data"
"4.924567","1434","443  >  51405 [ACK] Seq=40209 Ack=1 Win=501 Len=1380 [TCP segment of a reassembled PDU]"
"4.924716","110","Application Data"
"5.044374","1434","443  >  51405 [ACK] Seq=41645 Ack=1 Win=501 Len=1380 [TCP segment of a reassembled PDU]"
"5.045088","110","Application Data"
"5.233522","1434","443  >  51405 [ACK] Seq=43081 Ack=1 Win=501 Len=1380 [TCP segment of a reassembled PDU]"
"5.233685","110","Application Data"
"5.394955","1434","443  >  51405 [ACK] Seq=44517 Ack=1 Win=501 Len=1380 [TCP segment of a reassembled PDU]"
"5.395106","110","Application Data"
"5.592918","1434","443  >  51405 [ACK] Seq=45953 Ack=1 Win=501 Len=1380 [TCP segment of a reassembled PDU]"
"5.592919","110","Application Data"
"5.753481","1434","443  >  51405 [ACK] Seq=47389 Ack=1 Win=501 Len=1380 [TCP segment of a reassembled PDU]"
"5.753482","110","Application Data"
"5.911694","1434","443  >  51405 [ACK] Seq=48825 Ack=1 Win=501 Len=1380 [TCP segment of a reassembled PDU]"
"5.911882","110","Application Data"
"6.110900","1434","443  >  51405 [ACK] Seq=50261 Ack=1 Win=501 Len=1380 [TCP segment of a reassembled PDU]"
"6.110901","110","Application Data"
"6.317978","1434","443  >  51405 [ACK] Seq=51697 Ack=1 Win=501 Len=1380 [TCP segment of a reassembled PDU]"
"6.319044","110","Application Data"
"6.471987","1434","443  >  51405 [ACK] Seq=53133 Ack=1 Win=501 Len=1380 [TCP segment of a reassembled PDU]"
"6.471988","110","Application Data"
"6.630084","1434","443  >  51405 [ACK] Seq=54569 Ack=1 Win=501 Len=1380 [TCP segment of a reassembled PDU]"
"6.638889","110","Application Data"
"6.791054","1434","443  >  51405 [ACK] Seq=56005 Ack=1 Win=501 Len=1380 [TCP segment of a reassembled PDU]"
"6.791055","110","Application Data"
"6.999735","1434","443  >  51405 [ACK] Seq=57441 Ack=1 Win=501 Len=1380 [TCP segment of a reassembled PDU]"
"6.999873","110","Application Data"
"7.197988","1434","443  >  51405 [ACK] Seq=58877 Ack=1 Win=501 Len=1380 [TCP segment of a reassembled PDU]"
"7.197989","110","Application Data"
"7.328527","1434","443  >  51405 [ACK] Seq=60313 Ack=1 Win=501 Len=1380 [TCP segment of a reassembled PDU]"
"7.328528","110","Application Data"
"7.529514","1434","443  >  51405 [ACK] Seq=61749 Ack=1 Win=501 Len=1380 [TCP segment of a reassembled PDU]"
"7.533203","110","Application Data"
"7.691273","1434","443  >  51405 [ACK] Seq=63185 Ack=1 Win=501 Len=1380 [TCP segment of a reassembled PDU]"
"7.691273","110","Application Data"
"7.890891","1434","443  >  51405 [ACK] Seq=64621 Ack=1 Win=501 Len=1380 [TCP segment of a reassembled PDU]"
"7.891050","110","Application Data"
"8.088746","1434","443  >  51405 [ACK] Seq=66057 Ack=1 Win=501 Len=1380 [TCP segment of a reassembled PDU]"
"8.089059","110","Application Data"
"8.191858","1434","443  >  51405 [ACK] Seq=67493 Ack=1 Win=501 Len=1380 [TCP segment of a reassembled PDU]"
"8.192023","110","Application Data"
"8.407952","1434","443  >  51405 [ACK] Seq=68929 Ack=1 Win=501 Len=1380 [TCP segment of a reassembled PDU]"
"8.408188","110","Application Data"
"8.560325","1434","443  >  51405 [ACK] Seq=70365 Ack=1 Win=501 Len=1380 [TCP segment of a reassembled PDU]"
"8.560470","110","Application Data"
"8.716162","1434","443  >  51405 [ACK] Seq=71801 Ack=1 Win=501 Len=1380 [TCP segment of a reassembled PDU]"
"8.716318","110","Application Data"
"8.917498","1434","443  >  51405 [ACK] Seq=73237 Ack=1 Win=501 Len=1380 [TCP segment of a reassembled PDU]"
"8.917499","110","Application Data"
"9.077107","1434","443  >  51405 [ACK] Seq=74673 Ack=1 Win=501 Len=1380 [TCP segment of a reassembled PDU]"
"9.077108","110","Application Data"
"9.279615","1434","443  >  51405 [ACK] Seq=76109 Ack=1 Win=501 Len=1380 [TCP segment of a reassembled PDU]"
"9.279616","110","Application Data"
"9.435795","1434","443  >  51405 [ACK] Seq=77545 Ack=1 Win=501 Len=1380 [TCP segment of a reassembled PDU]"
"9.435796","110","Application Data"
"9.599342","1434","443  >  51405 [ACK] Seq=78981 Ack=1 Win=501 Len=1380 [TCP segment of a reassembled PDU]"
"9.599348","110","Application Data"
"9.791755","1434","443  >  51405 [ACK] Seq=80417 Ack=1 Win=501 Len=1380 [TCP segment of a reassembled PDU]"
"9.791757","110","Application Data"
"9.967192","1434","443  >  51405 [ACK] Seq=81853 Ack=1 Win=501 Len=1380 [TCP segment of a reassembled PDU]"
"9.967325","110","Application Data"
"10.152383","1434","443  >  51405 [ACK] Seq=83289 Ack=1 Win=501 Len=1380 [TCP segment of a reassembled PDU]"
"10.152385","110","Application Data"
"10.352270","1434","443  >  51405 [ACK] Seq=84725 Ack=1 Win=501 Len=1380 [TCP segment of a reassembled PDU]"
"10.352430","110","Application Data"
"10.474721","1434","443  >  51405 [ACK] Seq=86161 Ack=1 Win=501 Len=1380 [TCP segment of a reassembled PDU]"
"10.474858","110","Application Data"
"10.672329","1434","443  >  51405 [ACK] Seq=87597 Ack=1 Win=501 Len=1380 [TCP segment of a reassembled PDU]"
"10.672981","110","Application Data"
"10.835755","1434","443  >  51405 [ACK] Seq=89033 Ack=1 Win=501 Len=1380 [TCP segment of a reassembled PDU]"
"10.835760","110","Application Data"
"11.030265","1434","443  >  51405 [ACK] Seq=90469 Ack=1 Win=501 Len=1380 [TCP segment of a reassembled PDU]"
"11.030463","110","Application Data"
"11.156011","1434","443  >  51405 [ACK] Seq=91905 Ack=1 Win=501 Len=1380 [TCP segment of a reassembled PDU]"
"11.156012","110","Application Data"
"11.351058","1434","443  >  51405 [ACK] Seq=93341 Ack=1 Win=501 Len=1380 [TCP segment of a reassembled PDU]"
"11.351059","110","Application Data"
"11.570076","1434","443  >  51405 [ACK] Seq=94777 Ack=1 Win=501 Len=1380 [TCP segment of a reassembled PDU]"
"11.570080","110","Application Data"
"11.717173","1434","443  >  51405 [ACK] Seq=96213 Ack=1 Win=501 Len=1380 [TCP segment of a reassembled PDU]"
"11.717181","110","Application Data"
"11.872076","1434","443  >  51405 [ACK] Seq=97649 Ack=1 Win=501 Len=1380 [TCP segment of a reassembled PDU]"
"11.872258","110","Application Data"
"12.032209","1434","443  >  51405 [ACK] Seq=99085 Ack=1 Win=501 Len=1380 [TCP segment of a reassembled PDU]"
"12.032210","110","Application Data"
"12.242670","1434","443  >  51405 [ACK] Seq=100521 Ack=1 Win=501 Len=1380 [TCP segment of a reassembled PDU]"
"12.242671","110","Application Data"
"12.436420","1434","443  >  51405 [ACK] Seq=101957 Ack=1 Win=501 Len=1380 [TCP segment of a reassembled PDU]"
"12.436424","110","Application Data"
"12.554768","1434","443  >  51405 [ACK] Seq=103393 Ack=1 Win=501 Len=1380 [TCP segment of a reassembled PDU]"
"12.554770","110","Application Data"
"12.760425","1434","443  >  51405 [ACK] Seq=104829 Ack=1 Win=501 Len=1380 [TCP segment of a reassembled PDU]"
"12.760565","110","Application Data"
"12.953374","1434","443  >  51405 [ACK] Seq=106265 Ack=1 Win=501 Len=1380 [TCP segment of a reassembled PDU]"
"12.953375","110","Application Data"
"13.113102","1434","443  >  51405 [ACK] Seq=107701 Ack=1 Win=501 Len=1380 [TCP segment of a reassembled PDU]"
"13.113259","110","Application Data"
"13.331759","1434","443  >  51405 [ACK] Seq=109137 Ack=1 Win=501 Len=1380 [TCP segment of a reassembled PDU]"
"13.331759","110","Application Data"
"13.444732","1434","443  >  51405 [ACK] Seq=110573 Ack=1 Win=501 Len=1380 [TCP segment of a reassembled PDU]"
"13.444880","110","Application Data"
"13.631908","1434","443  >  51405 [ACK] Seq=112009 Ack=1 Win=501 Len=1380 [TCP segment of a reassembled PDU]"
"13.631908","110","Application Data"
"13.852518","1434","443  >  51405 [ACK] Seq=113445 Ack=1 Win=501 Len=1380 [TCP segment of a reassembled PDU]"
"13.852680","110","Application Data"
"13.955715","1434","443  >  51405 [ACK] Seq=114881 Ack=1 Win=501 Len=1380 [TCP segment of a reassembled PDU]"
"13.955715","110","Application Data"
"14.156937","1434","443  >  51405 [ACK] Seq=116317 Ack=1 Win=501 Len=1380 [TCP segment of a reassembled PDU]"
"14.157191","110","Application Data"
"14.318040","1434","443  >  51405 [ACK] Seq=117753 Ack=1 Win=501 Len=1380 [TCP segment of a reassembled PDU]"
"14.318171","110","Application Data"
"14.516665","1434","443  >  51405 [ACK] Seq=119189 Ack=1 Win=501 Len=1380 [TCP segment of a reassembled PDU]"
"14.516818","110","Application Data"
"14.720730","1434","443  >  51405 [ACK] Seq=120625 Ack=1 Win=501 Len=1380 [TCP segment of a reassembled PDU]"
"14.720865","110","Application Data"
"14.833974","1434","443  >  51405 [ACK] Seq=122061 Ack=1 Win=501 Len=1380 [TCP segment of a reassembled PDU]"
"14.834108","110","Application Data"
"15.035897","1434","443  >  51405 [ACK] Seq=123497 Ack=1 Win=501 Len=1380 [TCP segment of a reassembled PDU]"
"15.035898","110","Application Data"
"15.188691","1434","443  >  51405 [ACK] Seq=124933 Ack=1 Win=501 Len=1380 [TCP segment of a reassembled PDU]"
"15.188839","110","Application Data"
"15.397897","1434","443  >  51405 [ACK] Seq=126369 Ack=1 Win=501 Len=1380 [TCP segment of a reassembled PDU]"
"15.397897","110","Application Data"
"15.553871","1434","443  >  51405 [ACK] Seq=127805 Ack=1 Win=501 Len=1380 [TCP segment of a reassembled PDU]"
"15.553872","110","Application Data"
"15.715763","1434","443  >  51405 [ACK] Seq=129241 Ack=1 Win=501 Len=1380 [TCP segment of a reassembled PDU]"
"15.717596","110","Application Data"
"15.914845","1434","443  >  51405 [ACK] Seq=130677 Ack=1 Win=501 Len=1380 [TCP segment of a reassembled PDU]"
"15.923066","110","Application Data"
"16.087868","1434","443  >  51405 [ACK] Seq=132113 Ack=1 Win=501 Len=1380 [TCP segment of a reassembled PDU]"
"16.088084","110","Application Data"
"16.272192","1434","443  >  51405 [ACK] Seq=133549 Ack=1 Win=501 Len=1380 [TCP segment of a reassembled PDU]"
"16.272339","110","Application Data"
"16.430795","1434","443  >  51405 [ACK] Seq=134985 Ack=1 Win=501 Len=1380 [TCP segment of a reassembled PDU]"
"16.430796","110","Application Data"
"16.593694","1434","443  >  51405 [ACK] Seq=136421 Ack=1 Win=501 Len=1380 [TCP segment of a reassembled PDU]"
"16.593838","110","Application Data"
"16.790905","1434","443  >  51405 [ACK] Seq=137857 Ack=1 Win=501 Len=1380 [TCP segment of a reassembled PDU]"
"16.791612","110","Application Data"
"16.989778","1434","443  >  51405 [ACK] Seq=139293 Ack=1 Win=501 Len=1380 [TCP segment of a reassembled PDU]"
"16.989928","110","Application Data"
"17.111386","1434","443  >  51405 [ACK] Seq=140729 Ack=1 Win=501 Len=1380 [TCP segment of a reassembled PDU]"
"17.111387","110","Application Data"
"17.331241","1434","443  >  51405 [ACK] Seq=142165 Ack=1 Win=501 Len=1380 [TCP segment of a reassembled PDU]"
"17.331242","110","Application Data"
"17.472980","1434","443  >  51405 [ACK] Seq=143601 Ack=1 Win=501 Len=1380 [TCP segment of a reassembled PDU]"
"17.480307","110","Application Data"
"17.684427","1434","443  >  51405 [ACK] Seq=145037 Ack=1 Win=501 Len=1380 [TCP segment of a reassembled PDU]"
"17.684428","110","Application Data"
"17.880735","1434","443  >  51405 [ACK] Seq=146473 Ack=1 Win=501 Len=1380 [TCP segment of a reassembled PDU]"
"17.880883","110","Application Data"
"17.993811","1434","443  >  51405 [ACK] Seq=147909 Ack=1 Win=501 Len=1380 [TCP segment of a reassembled PDU]"
"17.993813","110","Application Data"
"18.194714","1434","443  >  51405 [ACK] Seq=149345 Ack=1 Win=501 Len=1380 [TCP segment of a reassembled PDU]"
"18.194715","110","Application Data"
"18.352888","1434","443  >  51405 [ACK] Seq=150781 Ack=1 Win=501 Len=1380 [TCP segment of a reassembled PDU]"
"18.353138","110","Application Data"
"18.555141","1434","443  >  51405 [ACK] Seq=152217 Ack=1 Win=501 Len=1380 [TCP segment of a reassembled PDU]"
"18.555289","110","Application Data"
"18.713754","1434","443  >  51405 [ACK] Seq=153653 Ack=1 Win=501 Len=1380 [TCP segment of a reassembled PDU]"
"18.713754","110","Application Data"
"18.872948","1434","443  >  51405 [ACK] Seq=155089 Ack=1 Win=501 Len=1380 [TCP segment of a reassembled PDU]"
"18.872949","110","Application Data"
"19.071039","1434","443  >  51405 [ACK] Seq=156525 Ack=1 Win=501 Len=1380 [TCP segment of a reassembled PDU]"
"19.071188","110","Application Data"
"19.242794","1434","443  >  51405 [ACK] Seq=157961 Ack=1 Win=501 Len=1380 [TCP segment of a reassembled PDU]"
"19.242794","110","Application Data"
"19.417260","1434","443  >  51405 [ACK] Seq=159397 Ack=1 Win=501 Len=1380 [TCP segment of a reassembled PDU]"
"19.417840","110","Application Data"
"19.598807","1434","443  >  51405 [ACK] Seq=160833 Ack=1 Win=501 Len=1380 [TCP segment of a reassembled PDU]"
"19.598808","110","Application Data"
"19.753557","1434","443  >  51405 [ACK] Seq=162269 Ack=1 Win=501 Len=1380 [TCP segment of a reassembled PDU]"
"19.762886","110","Application Data"
"19.961144","1434","443  >  51405 [ACK] Seq=163705 Ack=1 Win=501 Len=1380 [TCP segment of a reassembled PDU]"
"19.961145","110","Application Data"
"20.074936","1434","443  >  51405 [ACK] Seq=165141 Ack=1 Win=501 Len=1380 [TCP segment of a reassembled PDU]"
"20.074936","110","Application Data"
"20.271627","1434","443  >  51405 [ACK] Seq=166577 Ack=1 Win=501 Len=1380 [TCP segment of a reassembled PDU]"
"20.271771","110","Application Data"
"20.472040","1434","443  >  51405 [ACK] Seq=168013 Ack=1 Win=501 Len=1380 [TCP segment of a reassembled PDU]"
"20.472041","110","Application Data"
"20.644897","1434","443  >  51405 [ACK] Seq=169449 Ack=1 Win=501 Len=1380 [TCP segment of a reassembled PDU]"
"20.644898","110","Application Data"
"20.833299","1434","443  >  51405 [ACK] Seq=170885 Ack=1 Win=501 Len=1380 [TCP segment of a reassembled PDU]"
"20.833300","110","Application Data"
"20.953901","1434","443  >  51405 [ACK] Seq=172321 Ack=1 Win=501 Len=1380 [TCP segment of a reassembled PDU]"
"20.953903","110","Application Data"
"21.160370","1434","443  >  51405 [ACK] Seq=173757 Ack=1 Win=501 Len=1380 [TCP segment of a reassembled PDU]"
"21.160371","110","Application Data"
"21.356901","1434","443  >  51405 [ACK] Seq=175193 Ack=1 Win=501 Len=1380 [TCP segment of a reassembled PDU]"
"21.362086","110","Application Data"
"21.509690","1434","443  >  51405 [ACK] Seq=176629 Ack=1 Win=501 Len=1380 [TCP segment of a reassembled PDU]"
"21.509823","110","Application Data"
"21.677174","1434","443  >  51405 [ACK] Seq=178065 Ack=1 Win=501 Len=1380 [TCP segment of a reassembled PDU]"
"21.677175","110","Application Data"
"21.832723","1434","443  >  51405 [ACK] Seq=179501 Ack=1 Win=501 Len=1380 [TCP segment of a reassembled PDU]"
"21.832724","110","Application Data"
"22.034997","1434","443  >  51405 [ACK] Seq=180937 Ack=1 Win=501 Len=1380 [TCP segment of a reassembled PDU]"
"22.034998","110","Application Data"
"22.237330","1434","443  >  51405 [ACK] Seq=182373 Ack=1 Win=501 Len=1380 [TCP segment of a reassembled PDU]"
"22.237331","110","Application Data"
"22.396829","1434","443  >  51405 [ACK] Seq=183809 Ack=1 Win=501 Len=1380 [TCP segment of a reassembled PDU]"
"22.396830","110","Application Data"
"22.558809","1434","443  >  51405 [ACK] Seq=185245 Ack=1 Win=501 Len=1380 [TCP segment of a reassembled PDU]"
"22.558810","110","Application Data"
"22.752308","1434","443  >  51405 [ACK] Seq=186681 Ack=1 Win=501 Len=1380 [TCP segment of a reassembled PDU]"
"22.761107","110","Application Data"
"22.918127","1434","443  >  51405 [ACK] Seq=188117 Ack=1 Win=501 Len=1380 [TCP segment of a reassembled PDU]"
"22.918128","110","Application Data"
"23.112858","1434","443  >  51405 [ACK] Seq=189553 Ack=1 Win=501 Len=1380 [TCP segment of a reassembled PDU]"
"23.113727","110","Application Data"
"23.235033","1434","443  >  51405 [ACK] Seq=190989 Ack=1 Win=501 Len=1380 [TCP segment of a reassembled PDU]"
"23.235244","110","Application Data"
"23.431606","1434","443  >  51405 [ACK] Seq=192425 Ack=1 Win=501 Len=1380 [TCP segment of a reassembled PDU]"
"23.431607","110","Application Data"
"23.649796","110","[TCP Previous segment not captured] , Ignored Unknown Record"
"23.724018","1434","[TCP Retransmission] 443  >  51405 [ACK] Seq=193861 Ack=1 Win=501 Len=1380"
"23.818801","1434","443  >  51405 [ACK] Seq=195297 Ack=1 Win=501 Len=1380 [TCP segment of a reassembled PDU]"
"23.818802","110","Application Data"
"23.954944","1434","443  >  51405 [ACK] Seq=196733 Ack=1 Win=501 Len=1380 [TCP segment of a reassembled PDU]"
"23.963761","110","Application Data"
"24.118145","1434","443  >  51405 [ACK] Seq=198169 Ack=1 Win=501 Len=1380 [TCP segment of a reassembled PDU]"
"24.126858","110","Application Data"
"24.318092","1434","443  >  51405 [ACK] Seq=199605 Ack=1 Win=501 Len=1380 [TCP segment of a reassembled PDU]"
"24.318835","110","Application Data"
"24.519975","1434","443  >  51405 [ACK] Seq=201041 Ack=1 Win=501 Len=1380 [TCP segment of a reassembled PDU]"
"24.519977","110","Application Data"
"24.638029","1434","443  >  51405 [ACK] Seq=202477 Ack=1 Win=501 Len=1380 [TCP segment of a reassembled PDU]"
"24.638030","110","Application Data"
"24.839674","1434","443  >  51405 [ACK] Seq=203913 Ack=1 Win=501 Len=1380 [TCP segment of a reassembled PDU]"
"24.839674","110","Application Data"
"25.003844","1434","443  >  51405 [ACK] Seq=205349 Ack=1 Win=501 Len=1380 [TCP segment of a reassembled PDU]"
"25.003845","110","Application Data"
"25.202351","1434","443  >  51405 [ACK] Seq=206785 Ack=1 Win=501 Len=1380 [TCP segment of a reassembled PDU]"
"25.202494","110","Application Data"
"25.396436","1434","443  >  51405 [ACK] Seq=208221 Ack=1 Win=501 Len=1380 [TCP segment of a reassembled PDU]"
"25.396437","110","Application Data"
"25.512796","1434","443  >  51405 [ACK] Seq=209657 Ack=1 Win=501 Len=1380 [TCP segment of a reassembled PDU]"
"25.512797","110","Application Data"
"25.712283","1434","443  >  51405 [ACK] Seq=211093 Ack=1 Win=501 Len=1380 [TCP segment of a reassembled PDU]"
"25.712893","110","Application Data"
"25.874424","1434","443  >  51405 [ACK] Seq=212529 Ack=1 Win=501 Len=1380 [TCP segment of a reassembled PDU]"
"25.874572","110","Application Data"
"26.032827","1434","443  >  51405 [ACK] Seq=213965 Ack=1 Win=501 Len=1380 [TCP segment of a reassembled PDU]"
"26.033263","110","Application Data"
"26.234727","1434","443  >  51405 [ACK] Seq=215401 Ack=1 Win=501 Len=1380 [TCP segment of a reassembled PDU]"
"26.234733","110","Application Data"
"26.393510","1434","443  >  51405 [ACK] Seq=216837 Ack=1 Win=501 Len=1380 [TCP segment of a reassembled PDU]"
"26.393736","110","Application Data"
"26.593188","1434","443  >  51405 [ACK] Seq=218273 Ack=1 Win=501 Len=1380 [TCP segment of a reassembled PDU]"
"26.593188","110","Application Data"
"26.792459","1434","443  >  51405 [ACK] Seq=219709 Ack=1 Win=501 Len=1380 [TCP segment of a reassembled PDU]"
"26.793073","110","Application Data"
"26.917742","1434","443  >  51405 [ACK] Seq=221145 Ack=1 Win=501 Len=1380 [TCP segment of a reassembled PDU]"
"26.917893","110","Application Data"
"27.111843","1434","443  >  51405 [ACK] Seq=222581 Ack=1 Win=501 Len=1380 [TCP segment of a reassembled PDU]"
"27.112089","110","Application Data"
"27.279300","1434","443  >  51405 [ACK] Seq=224017 Ack=1 Win=501 Len=1380 [TCP segment of a reassembled PDU]"
"27.279525","110","Application Data"
"27.476567","1434","443  >  51405 [ACK] Seq=225453 Ack=1 Win=501 Len=1380 [TCP segment of a reassembled PDU]"
"27.476717","110","Application Data"
"27.594723","1434","443  >  51405 [ACK] Seq=226889 Ack=1 Win=501 Len=1380 [TCP segment of a reassembled PDU]"
"27.594955","110","Application Data"
"27.803430","1434","443  >  51405 [ACK] Seq=228325 Ack=1 Win=501 Len=1380 [TCP segment of a reassembled PDU]"
"27.803432","110","Application Data"
"27.999197","1434","443  >  51405 [ACK] Seq=229761 Ack=1 Win=501 Len=1380 [TCP segment of a reassembled PDU]"
"28.001731","110","Application Data"
"28.155728","1434","443  >  51405 [ACK] Seq=231197 Ack=1 Win=501 Len=1380 [TCP segment of a reassembled PDU]"
"28.155728","110","Application Data"
"28.364054","1434","443  >  51405 [ACK] Seq=232633 Ack=1 Win=501 Len=1380 [TCP segment of a reassembled PDU]"
"28.364203","110","Application Data"
"28.473164","1434","443  >  51405 [ACK] Seq=234069 Ack=1 Win=501 Len=1380 [TCP segment of a reassembled PDU]"
"28.473165","110","Application Data"
"28.670670","1434","443  >  51405 [ACK] Seq=235505 Ack=1 Win=501 Len=1380 [TCP segment of a reassembled PDU]"
"28.670671","110","Application Data"
"28.884389","1434","443  >  51405 [ACK] Seq=236941 Ack=1 Win=501 Len=1380 [TCP segment of a reassembled PDU]"
"28.884391","110","Application Data"
"29.040990","1434","443  >  51405 [ACK] Seq=238377 Ack=1 Win=501 Len=1380 [TCP segment of a reassembled PDU]"
"29.041152","110","Application Data"
"29.201862","1434","443  >  51405 [ACK] Seq=239813 Ack=1 Win=501 Len=1380 [TCP segment of a reassembled PDU]"
"29.201863","110","Application Data"
"29.409982","1434","443  >  51405 [ACK] Seq=241249 Ack=1 Win=501 Len=1380 [TCP segment of a reassembled PDU]"
"29.409983","110","Application Data"
"29.566187","1434","443  >  51405 [ACK] Seq=242685 Ack=1 Win=501 Len=1380 [TCP segment of a reassembled PDU]"
"29.566188","110","Application Data"
"29.770512","1434","443  >  51405 [ACK] Seq=244121 Ack=1 Win=501 Len=1380 [TCP segment of a reassembled PDU]"
"29.770513","110","Application Data"
"29.875895","1434","443  >  51405 [ACK] Seq=245557 Ack=1 Win=501 Len=1380 [TCP segment of a reassembled PDU]"
"29.876022","110","Application Data"
"30.070263","1434","443  >  51405 [ACK] Seq=246993 Ack=1 Win=501 Len=1380 [TCP segment of a reassembled PDU]"
"30.073336","110","Application Data"
"30.273913","1434","443  >  51405 [ACK] Seq=248429 Ack=1 Win=501 Len=1380 [TCP segment of a reassembled PDU]"
"30.274063","110","Application Data"
"30.445159","1434","443  >  51405 [ACK] Seq=249865 Ack=1 Win=501 Len=1380 [TCP segment of a reassembled PDU]"
"30.446177","110","Application Data"
"30.643773","1434","443  >  51405 [ACK] Seq=251301 Ack=1 Win=501 Len=1380 [TCP segment of a reassembled PDU]"
"30.643774","110","Application Data"
"30.753749","1434","443  >  51405 [ACK] Seq=252737 Ack=1 Win=501 Len=1380 [TCP segment of a reassembled PDU]"
"30.754111","110","Application Data"
"30.965977","1434","443  >  51405 [ACK] Seq=254173 Ack=1 Win=501 Len=1380 [TCP segment of a reassembled PDU]"
"30.966156","110","Application Data"
"31.159402","1434","443  >  51405 [ACK] Seq=255609 Ack=1 Win=501 Len=1380 [TCP segment of a reassembled PDU]"
"31.159566","110","Application Data"
"31.320835","1434","443  >  51405 [ACK] Seq=257045 Ack=1 Win=501 Len=1380 [TCP segment of a reassembled PDU]"
"31.320835","110","Application Data"
"31.475509","1434","443  >  51405 [ACK] Seq=258481 Ack=1 Win=501 Len=1380 [TCP segment of a reassembled PDU]"
"31.476181","110","Application Data"
"31.634175","1434","443  >  51405 [ACK] Seq=259917 Ack=1 Win=501 Len=1380 [TCP segment of a reassembled PDU]"
"31.634177","110","Application Data"
"31.849307","1434","443  >  51405 [ACK] Seq=261353 Ack=1 Win=501 Len=1380 [TCP segment of a reassembled PDU]"
"31.853050","110","Application Data"
"32.037386","1434","443  >  51405 [ACK] Seq=262789 Ack=1 Win=501 Len=1380 [TCP segment of a reassembled PDU]"
"32.037535","110","Application Data"
"32.201918","1434","443  >  51405 [ACK] Seq=264225 Ack=1 Win=501 Len=1380 [TCP segment of a reassembled PDU]"
"32.201919","110","Application Data"
"32.354481","1434","443  >  51405 [ACK] Seq=265661 Ack=1 Win=501 Len=1380 [TCP segment of a reassembled PDU]"
"32.354482","110","Application Data"
"32.510951","1434","443  >  51405 [ACK] Seq=267097 Ack=1 Win=501 Len=1380 [TCP segment of a reassembled PDU]"
"32.511118","110","Application Data"
"32.710630","1434","443  >  51405 [ACK] Seq=268533 Ack=1 Win=501 Len=1380 [TCP segment of a reassembled PDU]"
"32.710631","110","Application Data"
"32.924684","1434","443  >  51405 [ACK] Seq=269969 Ack=1 Win=501 Len=1380 [TCP segment of a reassembled PDU]"
"32.924684","110","Application Data"
"33.042338","1434","443  >  51405 [ACK] Seq=271405 Ack=1 Win=501 Len=1380 [TCP segment of a reassembled PDU]"
"33.042585","110","Application Data"
"33.248384","1434","443  >  51405 [ACK] Seq=272841 Ack=1 Win=501 Len=1380 [TCP segment of a reassembled PDU]"
"33.250192","110","Application Data"
"33.436281","1434","443  >  51405 [ACK] Seq=274277 Ack=1 Win=501 Len=1380 [TCP segment of a reassembled PDU]"
"33.436479","110","Application Data"
"33.555038","1434","443  >  51405 [ACK] Seq=275713 Ack=1 Win=501 Len=1380 [TCP segment of a reassembled PDU]"
"33.555039","110","Application Data"
"33.752100","1434","443  >  51405 [ACK] Seq=277149 Ack=1 Win=501 Len=1380 [TCP segment of a reassembled PDU]"
"33.752245","110","Application Data"
"33.915215","1434","443  >  51405 [ACK] Seq=278585 Ack=1 Win=501 Len=1380 [TCP segment of a reassembled PDU]"
"33.919375","110","Application Data"
"34.120894","1434","443  >  51405 [ACK] Seq=280021 Ack=1 Win=501 Len=1380 [TCP segment of a reassembled PDU]"
"34.120896","110","Application Data"
"34.313612","1434","443  >  51405 [ACK] Seq=281457 Ack=1 Win=501 Len=1380 [TCP segment of a reassembled PDU]"
"34.313613","110","Application Data"
"34.437610","1434","443  >  51405 [ACK] Seq=282893 Ack=1 Win=501 Len=1380 [TCP segment of a reassembled PDU]"
"34.437756","110","Application Data"
"34.637179","1434","443  >  51405 [ACK] Seq=284329 Ack=1 Win=501 Len=1380 [TCP segment of a reassembled PDU]"
"34.637181","110","Application Data"
"34.795806","1434","443  >  51405 [ACK] Seq=285765 Ack=1 Win=501 Len=1380 [TCP segment of a reassembled PDU]"
"34.795806","110","Application Data"
"34.992362","1434","443  >  51405 [ACK] Seq=287201 Ack=1 Win=501 Len=1380 [TCP segment of a reassembled PDU]"
"34.993012","110","Application Data"
"35.206884","1434","443  >  51405 [ACK] Seq=288637 Ack=1 Win=501 Len=1380 [TCP segment of a reassembled PDU]"
"35.206885","110","Application Data"
"35.313814","1434","443  >  51405 [ACK] Seq=290073 Ack=1 Win=501 Len=1380 [TCP segment of a reassembled PDU]"
"35.313815","110","Application Data"
"35.514823","1434","443  >  51405 [ACK] Seq=291509 Ack=1 Win=501 Len=1380 [TCP segment of a reassembled PDU]"
"35.514970","110","Application Data"
"35.670026","1434","443  >  51405 [ACK] Seq=292945 Ack=1 Win=501 Len=1380 [TCP segment of a reassembled PDU]"
"35.670166","110","Application Data"
"35.872577","1434","443  >  51405 [ACK] Seq=294381 Ack=1 Win=501 Len=1380 [TCP segment of a reassembled PDU]"
"35.872578","110","Application Data"
"36.072687","1434","443  >  51405 [ACK] Seq=295817 Ack=1 Win=501 Len=1380 [TCP segment of a reassembled PDU]"
"36.072841","110","Application Data"
"36.196286","1434","443  >  51405 [ACK] Seq=297253 Ack=1 Win=501 Len=1380 [TCP segment of a reassembled PDU]"
"36.196287","110","Application Data"
"36.391782","1434","443  >  51405 [ACK] Seq=298689 Ack=1 Win=501 Len=1380 [TCP segment of a reassembled PDU]"
"36.391940","110","Application Data"
"36.551815","1434","443  >  51405 [ACK] Seq=300125 Ack=1 Win=501 Len=1380 [TCP segment of a reassembled PDU]"
"36.552087","110","Application Data"
"36.709886","1434","443  >  51405 [ACK] Seq=301561 Ack=1 Win=501 Len=1380 [TCP segment of a reassembled PDU]"
"36.709887","110","Application Data"
"36.923318","1434","443  >  51405 [ACK] Seq=302997 Ack=1 Win=501 Len=1380 [TCP segment of a reassembled PDU]"
"36.923319","110","Application Data"
"37.071086","1434","443  >  51405 [ACK] Seq=304433 Ack=1 Win=501 Len=1380 [TCP segment of a reassembled PDU]"
"37.071086","110","Application Data"
"37.278448","1434","443  >  51405 [ACK] Seq=305869 Ack=1 Win=501 Len=1380 [TCP segment of a reassembled PDU]"
"37.279071","110","Application Data"
"37.472424","1434","443  >  51405 [ACK] Seq=307305 Ack=1 Win=501 Len=1380 [TCP segment of a reassembled PDU]"
"37.472425","110","Application Data"
"37.592789","1434","443  >  51405 [ACK] Seq=308741 Ack=1 Win=501 Len=1380 [TCP segment of a reassembled PDU]"
"37.592789","110","Application Data"
"37.800537","1434","443  >  51405 [ACK] Seq=310177 Ack=1 Win=501 Len=1380 [TCP segment of a reassembled PDU]"
"37.800539","110","Application Data"
"37.958836","1434","443  >  51405 [ACK] Seq=311613 Ack=1 Win=501 Len=1380 [TCP segment of a reassembled PDU]"
"37.958837","110","Application Data"
"38.154178","1434","443  >  51405 [ACK] Seq=313049 Ack=1 Win=501 Len=1380 [TCP segment of a reassembled PDU]"
"38.154179","110","Application Data"
"38.273537","1434","443  >  51405 [ACK] Seq=314485 Ack=1 Win=501 Len=1380 [TCP segment of a reassembled PDU]"
"38.275029","110","Application Data"
"38.479368","1434","443  >  51405 [ACK] Seq=315921 Ack=1 Win=501 Len=1380 [TCP segment of a reassembled PDU]"
"38.479369","110","Application Data"
"38.674444","1434","443  >  51405 [ACK] Seq=317357 Ack=1 Win=501 Len=1380 [TCP segment of a reassembled PDU]"
"38.674445","110","Application Data"
"38.836611","1434","443  >  51405 [ACK] Seq=318793 Ack=1 Win=501 Len=1380 [TCP segment of a reassembled PDU]"
"38.837304","110","Application Data"
"39.043860","1434","443  >  51405 [ACK] Seq=320229 Ack=1 Win=501 Len=1380 [TCP segment of a reassembled PDU]"
"39.044009","110","Application Data"
"39.194732","1434","443  >  51405 [ACK] Seq=321665 Ack=1 Win=501 Len=1380 [TCP segment of a reassembled PDU]"
"39.194732","110","Application Data"
"39.350966","1434","443  >  51405 [ACK] Seq=323101 Ack=1 Win=501 Len=1380 [TCP segment of a reassembled PDU]"
"39.351206","110","Application Data"
"39.553811","1434","443  >  51405 [ACK] Seq=324537 Ack=1 Win=501 Len=1380 [TCP segment of a reassembled PDU]"
"39.553812","110","Application Data"
"39.714675","1434","443  >  51405 [ACK] Seq=325973 Ack=1 Win=501 Len=1380 [TCP segment of a reassembled PDU]"
"39.714675","110","Application Data"
"39.876912","1434","443  >  51405 [ACK] Seq=327409 Ack=1 Win=501 Len=1380 [TCP segment of a reassembled PDU]"
"39.877058","110","Application Data"
"40.073338","1434","443  >  51405 [ACK] Seq=328845 Ack=1 Win=501 Len=1380 [TCP segment of a reassembled PDU]"
"40.074051","110","Application Data"
"40.234327","1434","443  >  51405 [ACK] Seq=330281 Ack=1 Win=501 Len=1380 [TCP segment of a reassembled PDU]"
"40.234332","110","Application Data"
"40.436535","1434","443  >  51405 [ACK] Seq=331717 Ack=1 Win=501 Len=1380 [TCP segment of a reassembled PDU]"
"40.436537","110","Application Data"
"40.567141","1434","443  >  51405 [ACK] Seq=333153 Ack=1 Win=501 Len=1380 [TCP segment of a reassembled PDU]"
"40.567142","110","Application Data"
"40.752947","1434","443  >  51405 [ACK] Seq=334589 Ack=1 Win=501 Len=1380 [TCP segment of a reassembled PDU]"
"40.752948","110","Application Data"
"40.952820","1434","443  >  51405 [ACK] Seq=336025 Ack=1 Win=501 Len=1380 [TCP segment of a reassembled PDU]"
"40.953018","110","Application Data"
"41.122797","1434","443  >  51405 [ACK] Seq=337461 Ack=1 Win=501 Len=1380 [TCP segment of a reassembled PDU]"
"41.122797","110","Application Data"
"41.313500","1434","443  >  51405 [ACK] Seq=338897 Ack=1 Win=501 Len=1380 [TCP segment of a reassembled PDU]"
"41.313500","110","Application Data"
"41.434002","1434","443  >  51405 [ACK] Seq=340333 Ack=1 Win=501 Len=1380 [TCP segment of a reassembled PDU]"
"41.434003","110","Application Data"
"41.638639","1434","443  >  51405 [ACK] Seq=341769 Ack=1 Win=501 Len=1380 [TCP segment of a reassembled PDU]"
"41.638787","110","Application Data"
"41.837681","1434","443  >  51405 [ACK] Seq=343205 Ack=1 Win=501 Len=1380 [TCP segment of a reassembled PDU]"
"41.837682","110","Application Data"
"42.009642","1434","443  >  51405 [ACK] Seq=344641 Ack=1 Win=501 Len=1380 [TCP segment of a reassembled PDU]"
"42.009643","110","Application Data"
"42.156869","1434","443  >  51405 [ACK] Seq=346077 Ack=1 Win=501 Len=1380 [TCP segment of a reassembled PDU]"
"42.157017","110","Application Data"
"42.318764","1434","443  >  51405 [ACK] Seq=347513 Ack=1 Win=501 Len=1380 [TCP segment of a reassembled PDU]"
"42.318764","110","Application Data"
"42.518870","1434","443  >  51405 [ACK] Seq=348949 Ack=1 Win=501 Len=1380 [TCP segment of a reassembled PDU]"
"42.518871","110","Application Data"
"42.711702","1434","443  >  51405 [ACK] Seq=350385 Ack=1 Win=501 Len=1380 [TCP segment of a reassembled PDU]"
"42.711851","110","Application Data"
"42.844521","1434","443  >  51405 [ACK] Seq=351821 Ack=1 Win=501 Len=1380 [TCP segment of a reassembled PDU]"
"42.844522","110","Application Data"
"43.048036","1434","443  >  51405 [ACK] Seq=353257 Ack=1 Win=501 Len=1380 [TCP segment of a reassembled PDU]"
"43.048037","110","Application Data"
"43.233940","1434","443  >  51405 [ACK] Seq=354693 Ack=1 Win=501 Len=1380 [TCP segment of a reassembled PDU]"
"43.233946","110","Application Data"
"43.427611","110","[TCP Previous segment not captured] , Ignored Unknown Record"
"43.527592","1434","[TCP Retransmission] 443  >  51405 [ACK] Seq=356129 Ack=1 Win=501 Len=1380"
"43.582463","1434","443  >  51405 [ACK] Seq=357565 Ack=1 Win=501 Len=1380 [TCP segment of a reassembled PDU]"
"43.584093","110","Application Data"
"43.713529","1434","443  >  51405 [ACK] Seq=359001 Ack=1 Win=501 Len=1380 [TCP segment of a reassembled PDU]"
"43.713529","110","Application Data"
"43.928357","1434","443  >  51405 [ACK] Seq=360437 Ack=1 Win=501 Len=1380 [TCP segment of a reassembled PDU]"
"43.928358","110","Application Data"
"44.110638","1434","443  >  51405 [ACK] Seq=361873 Ack=1 Win=501 Len=1380 [TCP segment of a reassembled PDU]"
"44.110638","110","Application Data"
"44.271745","1434","443  >  51405 [ACK] Seq=363309 Ack=1 Win=501 Len=1380 [TCP segment of a reassembled PDU]"
"44.271745","110","Application Data"
"44.434800","1434","443  >  51405 [ACK] Seq=364745 Ack=1 Win=501 Len=1380 [TCP segment of a reassembled PDU]"
"44.435121","110","Application Data"
"44.591720","1434","443  >  51405 [ACK] Seq=366181 Ack=1 Win=501 Len=1380 [TCP segment of a reassembled PDU]"
"44.591720","110","Application Data"
"44.796567","1434","443  >  51405 [ACK] Seq=367617 Ack=1 Win=501 Len=1380 [TCP segment of a reassembled PDU]"
"44.796568","110","Application Data"
"44.996001","1434","443  >  51405 [ACK] Seq=369053 Ack=1 Win=501 Len=1380 [TCP segment of a reassembled PDU]"
"44.996237","110","Application Data"
"45.118692","1434","443  >  51405 [ACK] Seq=370489 Ack=1 Win=501 Len=1380 [TCP segment of a reassembled PDU]"
"45.118919","110","Application Data"
"45.320663","1434","443  >  51405 [ACK] Seq=371925 Ack=1 Win=501 Len=1380 [TCP segment of a reassembled PDU]"
"45.320664","110","Application Data"
"45.493061","1434","443  >  51405 [ACK] Seq=373361 Ack=1 Win=501 Len=1380 [TCP segment of a reassembled PDU]"
"45.493062","110","Application Data"
"45.671900","1434","443  >  51405 [ACK] Seq=374797 Ack=1 Win=501 Len=1380 [TCP segment of a reassembled PDU]"
"45.672047","110","Application Data"
"45.833536","1434","443  >  51405 [ACK] Seq=376233 Ack=1 Win=501 Len=1380 [TCP segment of a reassembled PDU]"
"45.833537","110","Application Data"
"46.034984","110","[TCP Previous segment not captured] , Ignored Unknown Record"
"46.110325","1434","[TCP Retransmission] 443  >  51405 [ACK] Seq=377669 Ack=1 Win=501 Len=1380"
"46.189478","1434","443  >  51405 [ACK] Seq=379105 Ack=1 Win=501 Len=1380 [TCP segment of a reassembled PDU]"
"46.189610","110","Application Data"
"46.352549","1434","443  >  51405 [ACK] Seq=380541 Ack=1 Win=501 Len=1380 [TCP segment of a reassembled PDU]"
"46.353332","110","Application Data"
"46.552846","1434","443  >  51405 [ACK] Seq=381977 Ack=1 Win=501 Len=1380 [TCP segment of a reassembled PDU]"
"46.553154","110","Application Data"
"46.713937","1434","443  >  51405 [ACK] Seq=383413 Ack=1 Win=501 Len=1380 [TCP segment of a reassembled PDU]"
"46.713938","110","Application Data"
"46.871565","1434","443  >  51405 [ACK] Seq=384849 Ack=1 Win=501 Len=1380 [TCP segment of a reassembled PDU]"
"46.871700","110","Application Data"
