"Time","Length","Info"
"0.252927","1506","Application Data"
"0.252930","1506","443  >  50638 [ACK] Seq=1453 Ack=1439 Win=335 Len=1452 [TCP segment of a reassembled PDU]"
"0.252933","1506","443  >  50638 [ACK] Seq=2905 Ack=1439 Win=335 Len=1452 [TCP segment of a reassembled PDU]"
"0.253575","1506","443  >  50638 [ACK] Seq=4357 Ack=1439 Win=335 Len=1452 [TCP segment of a reassembled PDU]"
"0.253577","1506","443  >  50638 [ACK] Seq=5809 Ack=1439 Win=335 Len=1452 [TCP segment of a reassembled PDU]"
"0.255588","1506","443  >  50638 [ACK] Seq=7261 Ack=1439 Win=335 Len=1452 [TCP segment of a reassembled PDU]"
"0.255591","1506","443  >  50638 [ACK] Seq=8713 Ack=1439 Win=335 Len=1452 [TCP segment of a reassembled PDU]"
"0.255592","1506","443  >  50638 [ACK] Seq=10165 Ack=1439 Win=335 Len=1452 [TCP segment of a reassembled PDU]"
"0.255594","1506","443  >  50638 [ACK] Seq=11617 Ack=1439 Win=335 Len=1452 [TCP segment of a reassembled PDU]"
"0.255596","1506","443  >  50638 [ACK] Seq=13069 Ack=1439 Win=335 Len=1452 [TCP segment of a reassembled PDU]"
"0.255597","1506","443  >  50638 [ACK] Seq=14521 Ack=1439 Win=335 Len=1452 [TCP segment of a reassembled PDU]"
"0.255599","1506","443  >  50638 [ACK] Seq=15973 Ack=1439 Win=335 Len=1452 [TCP segment of a reassembled PDU]"
"0.256870","1506","Application Data [TCP segment of a reassembled PDU]"
"0.256871","1506","443  >  50638 [ACK] Seq=18877 Ack=1439 Win=335 Len=1452 [TCP segment of a reassembled PDU]"
"0.256872","1506","443  >  50638 [ACK] Seq=20329 Ack=1439 Win=335 Len=1452 [TCP segment of a reassembled PDU]"
"0.256874","1506","443  >  50638 [ACK] Seq=21781 Ack=1439 Win=335 Len=1452 [TCP segment of a reassembled PDU]"
"0.256875","1506","443  >  50638 [ACK] Seq=23233 Ack=1439 Win=335 Len=1452 [TCP segment of a reassembled PDU]"
"0.256876","1506","443  >  50638 [ACK] Seq=24685 Ack=1439 Win=335 Len=1452 [TCP segment of a reassembled PDU]"
"0.256877","1506","443  >  50638 [ACK] Seq=26137 Ack=1439 Win=335 Len=1452 [TCP segment of a reassembled PDU]"
"0.258199","1506","443  >  50638 [ACK] Seq=27589 Ack=1439 Win=335 Len=1452 [TCP segment of a reassembled PDU]"
"0.258200","1506","443  >  50638 [ACK] Seq=29041 Ack=1439 Win=335 Len=1452 [TCP segment of a reassembled PDU]"
"0.258201","1506","443  >  50638 [ACK] Seq=30493 Ack=1439 Win=335 Len=1452 [TCP segment of a reassembled PDU]"
"0.261321","1506","443  >  50638 [ACK] Seq=31945 Ack=1439 Win=335 Len=1452 [TCP segment of a reassembled PDU]"
"0.261322","508","443  >  50638 [PSH, ACK] Seq=33397 Ack=1439 Win=335 Len=454 [TCP segment of a reassembled PDU]"
"0.262819","1506","Application Data [TCP segment of a reassembled PDU]"
"0.262822","1506","443  >  50638 [ACK] Seq=35303 Ack=1439 Win=335 Len=1452 [TCP segment of a reassembled PDU]"
"0.262828","1506","443  >  50638 [ACK] Seq=36755 Ack=1439 Win=335 Len=1452 [TCP segment of a reassembled PDU]"
"0.262830","1506","443  >  50638 [ACK] Seq=38207 Ack=1439 Win=335 Len=1452 [TCP segment of a reassembled PDU]"
"0.262832","1506","443  >  50638 [ACK] Seq=39659 Ack=1439 Win=335 Len=1452 [TCP segment of a reassembled PDU]"
"0.263667","1506","443  >  50638 [ACK] Seq=41111 Ack=1439 Win=335 Len=1452 [TCP segment of a reassembled PDU]"
"0.263672","1506","443  >  50638 [ACK] Seq=42563 Ack=1439 Win=335 Len=1452 [TCP segment of a reassembled PDU]"
"0.263676","1506","443  >  50638 [ACK] Seq=44015 Ack=1439 Win=335 Len=1452 [TCP segment of a reassembled PDU]"
"0.264718","1506","443  >  50638 [ACK] Seq=45467 Ack=1439 Win=335 Len=1452 [TCP segment of a reassembled PDU]"
"0.264720","1506","[TCP Previous segment not captured] , Ignored Unknown Record"
"0.264721","1506","Ignored Unknown Record"
"0.264722","1506","Ignored Unknown Record"
"0.264723","1506","Ignored Unknown Record"
"0.264724","1506","Ignored Unknown Record"
"0.264726","966","Ignored Unknown Record"
"0.265609","1506","443  >  50638 [ACK] Seq=66707 Ack=1439 Win=335 Len=1452 [TCP segment of a reassembled PDU]"
"0.266761","1506","443  >  50638 [ACK] Seq=68159 Ack=1439 Win=335 Len=1452 [TCP segment of a reassembled PDU]"
"0.266768","1506","443  >  50638 [ACK] Seq=69611 Ack=1439 Win=335 Len=1452 [TCP segment of a reassembled PDU]"
"0.266771","1506","443  >  50638 [ACK] Seq=71063 Ack=1439 Win=335 Len=1452 [TCP segment of a reassembled PDU]"
"0.266777","1506","443  >  50638 [ACK] Seq=72515 Ack=1439 Win=335 Len=1452 [TCP segment of a reassembled PDU]"
"0.266783","1506","443  >  50638 [ACK] Seq=73967 Ack=1439 Win=335 Len=1452 [TCP segment of a reassembled PDU]"
"0.266786","1506","443  >  50638 [ACK] Seq=75419 Ack=1439 Win=335 Len=1452 [TCP segment of a reassembled PDU]"
"0.266791","1506","443  >  50638 [ACK] Seq=76871 Ack=1439 Win=335 Len=1452 [TCP segment of a reassembled PDU]"
"0.268613","1506","443  >  50638 [ACK] Seq=78323 Ack=1439 Win=335 Len=1452 [TCP segment of a reassembled PDU]"
"0.268614","1506","443  >  50638 [ACK] Seq=79775 Ack=1439 Win=335 Len=1452 [TCP segment of a reassembled PDU]"
"0.268615","1506","443  >  50638 [ACK] Seq=81227 Ack=1439 Win=335 Len=1452 [TCP segment of a reassembled PDU]"
"0.268616","1383","Application Data, Application Data"
"0.273342","1506","[TCP Fast Retransmission] 443  >  50638 [ACK] Seq=46919 Ack=1439 Win=335 Len=1452 [TCP segment of a reassembled PDU]"
"0.273343","1506","[TCP Retransmission] 443  >  50638 [ACK] Seq=48371 Ack=1439 Win=335 Len=1452"
"0.275368","1506","[TCP Retransmission] 443  >  50638 [ACK] Seq=49823 Ack=1439 Win=335 Len=1452"
"0.275372","1506","[TCP Retransmission] 443  >  50638 [ACK] Seq=51275 Ack=1439 Win=335 Len=1452"
"0.275557","1506","[TCP Retransmission] 443  >  50638 [ACK] Seq=52727 Ack=1439 Win=335 Len=1452"
"0.276215","1506","[TCP Retransmission] 443  >  50638 [ACK] Seq=54179 Ack=1439 Win=335 Len=1452"
"0.276216","1506","[TCP Retransmission] 443  >  50638 [ACK] Seq=55631 Ack=1439 Win=335 Len=1452"
"0.276217","1506","[TCP Retransmission] 443  >  50638 [ACK] Seq=57083 Ack=1439 Win=335 Len=1452"
"0.405971","60","443  >  50638 [ACK] Seq=84008 Ack=2995 Win=347 Len=0"
"0.405972","1506","Application Data"
"0.405973","1506","443  >  50638 [ACK] Seq=85460 Ack=2995 Win=347 Len=1452 [TCP segment of a reassembled PDU]"
"0.405977","1506","443  >  50638 [ACK] Seq=86912 Ack=2995 Win=347 Len=1452 [TCP segment of a reassembled PDU]"
"0.405978","1506","443  >  50638 [ACK] Seq=88364 Ack=2995 Win=347 Len=1452 [TCP segment of a reassembled PDU]"
"0.405979","1506","443  >  50638 [ACK] Seq=89816 Ack=2995 Win=347 Len=1452 [TCP segment of a reassembled PDU]"
"0.406589","1506","443  >  50638 [ACK] Seq=91268 Ack=2995 Win=347 Len=1452 [TCP segment of a reassembled PDU]"
"0.408425","1506","443  >  50638 [ACK] Seq=92720 Ack=2995 Win=347 Len=1452 [TCP segment of a reassembled PDU]"
"0.408427","1506","443  >  50638 [ACK] Seq=94172 Ack=2995 Win=347 Len=1452 [TCP segment of a reassembled PDU]"
"0.408428","1506","443  >  50638 [ACK] Seq=95624 Ack=2995 Win=347 Len=1452 [TCP segment of a reassembled PDU]"
"0.408428","1506","443  >  50638 [ACK] Seq=97076 Ack=2995 Win=347 Len=1452 [TCP segment of a reassembled PDU]"
"0.408430","1506","443  >  50638 [ACK] Seq=98528 Ack=2995 Win=347 Len=1452 [TCP segment of a reassembled PDU]"
"0.408431","1506","443  >  50638 [ACK] Seq=99980 Ack=2995 Win=347 Len=1452 [TCP segment of a reassembled PDU]"
"0.408431","1506","Application Data [TCP segment of a reassembled PDU]"
"0.409498","1506","443  >  50638 [ACK] Seq=102884 Ack=2995 Win=347 Len=1452 [TCP segment of a reassembled PDU]"
"0.409499","1506","443  >  50638 [ACK] Seq=104336 Ack=2995 Win=347 Len=1452 [TCP segment of a reassembled PDU]"
"0.409499","1506","443  >  50638 [ACK] Seq=105788 Ack=2995 Win=347 Len=1452 [TCP segment of a reassembled PDU]"
"0.410976","1506","443  >  50638 [ACK] Seq=107240 Ack=2995 Win=347 Len=1452 [TCP segment of a reassembled PDU]"
"0.410978","1506","443  >  50638 [ACK] Seq=108692 Ack=2995 Win=347 Len=1452 [TCP segment of a reassembled PDU]"
"0.410979","1506","443  >  50638 [ACK] Seq=110144 Ack=2995 Win=347 Len=1452 [TCP segment of a reassembled PDU]"
"0.410980","1506","443  >  50638 [ACK] Seq=111596 Ack=2995 Win=347 Len=1452 [TCP segment of a reassembled PDU]"
"0.412325","1506","443  >  50638 [ACK] Seq=113048 Ack=2995 Win=347 Len=1452 [TCP segment of a reassembled PDU]"
"0.412330","1506","443  >  50638 [ACK] Seq=114500 Ack=2995 Win=347 Len=1452 [TCP segment of a reassembled PDU]"
"0.412333","1506","443  >  50638 [ACK] Seq=115952 Ack=2995 Win=347 Len=1452 [TCP segment of a reassembled PDU]"
"0.412337","540","443  >  50638 [PSH, ACK] Seq=117404 Ack=2995 Win=347 Len=486 [TCP segment of a reassembled PDU]"
"0.413583","1506","Application Data [TCP segment of a reassembled PDU]"
"0.413584","1506","443  >  50638 [ACK] Seq=119342 Ack=2995 Win=347 Len=1452 [TCP segment of a reassembled PDU]"
"0.413585","1506","443  >  50638 [ACK] Seq=120794 Ack=2995 Win=347 Len=1452 [TCP segment of a reassembled PDU]"
"0.413587","1506","443  >  50638 [ACK] Seq=122246 Ack=2995 Win=347 Len=1452 [TCP segment of a reassembled PDU]"
"0.413588","1506","443  >  50638 [ACK] Seq=123698 Ack=2995 Win=347 Len=1452 [TCP segment of a reassembled PDU]"
"0.413589","1506","443  >  50638 [ACK] Seq=125150 Ack=2995 Win=347 Len=1452 [TCP segment of a reassembled PDU]"
"0.413590","1506","443  >  50638 [ACK] Seq=126602 Ack=2995 Win=347 Len=1452 [TCP segment of a reassembled PDU]"
"0.413592","1506","443  >  50638 [ACK] Seq=128054 Ack=2995 Win=347 Len=1452 [TCP segment of a reassembled PDU]"
"0.413594","1506","443  >  50638 [ACK] Seq=129506 Ack=2995 Win=347 Len=1452 [TCP segment of a reassembled PDU]"
"0.413595","1506","443  >  50638 [ACK] Seq=130958 Ack=2995 Win=347 Len=1452 [TCP segment of a reassembled PDU]"
"0.416674","1506","443  >  50638 [ACK] Seq=132410 Ack=2995 Win=347 Len=1452 [TCP segment of a reassembled PDU]"
"0.416683","1506","Application Data [TCP segment of a reassembled PDU]"
"0.416688","1506","443  >  50638 [ACK] Seq=135314 Ack=2995 Win=347 Len=1452 [TCP segment of a reassembled PDU]"
"0.416694","1506","443  >  50638 [ACK] Seq=136766 Ack=2995 Win=347 Len=1452 [TCP segment of a reassembled PDU]"
"0.416699","1506","443  >  50638 [ACK] Seq=138218 Ack=2995 Win=347 Len=1452 [TCP segment of a reassembled PDU]"
"0.416701","1506","443  >  50638 [ACK] Seq=139670 Ack=2995 Win=347 Len=1452 [TCP segment of a reassembled PDU]"
"0.416714","1506","443  >  50638 [ACK] Seq=141122 Ack=2995 Win=347 Len=1452 [TCP segment of a reassembled PDU]"
"0.416721","1506","443  >  50638 [ACK] Seq=142574 Ack=2995 Win=347 Len=1452 [TCP segment of a reassembled PDU]"
"0.416730","1506","443  >  50638 [ACK] Seq=144026 Ack=2995 Win=347 Len=1452 [TCP segment of a reassembled PDU]"
"0.416742","1506","443  >  50638 [ACK] Seq=145478 Ack=2995 Win=347 Len=1452 [TCP segment of a reassembled PDU]"
"0.418173","1506","443  >  50638 [ACK] Seq=146930 Ack=2995 Win=347 Len=1452 [TCP segment of a reassembled PDU]"
"0.418175","1506","443  >  50638 [ACK] Seq=148382 Ack=2995 Win=347 Len=1452 [TCP segment of a reassembled PDU]"
"0.418176","966","Application Data"
"0.418179","1506","443  >  50638 [ACK] Seq=150746 Ack=2995 Win=347 Len=1452 [TCP segment of a reassembled PDU]"
"0.418181","1506","443  >  50638 [ACK] Seq=152198 Ack=2995 Win=347 Len=1452 [TCP segment of a reassembled PDU]"
"0.418182","1506","443  >  50638 [ACK] Seq=153650 Ack=2995 Win=347 Len=1452 [TCP segment of a reassembled PDU]"
"0.418183","1506","443  >  50638 [ACK] Seq=155102 Ack=2995 Win=347 Len=1452 [TCP segment of a reassembled PDU]"
"0.418184","1506","443  >  50638 [ACK] Seq=156554 Ack=2995 Win=347 Len=1452 [TCP segment of a reassembled PDU]"
"0.418185","1506","443  >  50638 [ACK] Seq=158006 Ack=2995 Win=347 Len=1452 [TCP segment of a reassembled PDU]"
"0.418187","1506","443  >  50638 [ACK] Seq=159458 Ack=2995 Win=347 Len=1452 [TCP segment of a reassembled PDU]"
"0.418967","1506","443  >  50638 [ACK] Seq=160910 Ack=2995 Win=347 Len=1452 [TCP segment of a reassembled PDU]"
"0.421163","1506","443  >  50638 [ACK] Seq=162362 Ack=2995 Win=347 Len=1452 [TCP segment of a reassembled PDU]"
"0.421164","1506","443  >  50638 [ACK] Seq=163814 Ack=2995 Win=347 Len=1452 [TCP segment of a reassembled PDU]"
"0.421165","1506","443  >  50638 [ACK] Seq=165266 Ack=2995 Win=347 Len=1452 [TCP segment of a reassembled PDU]"
"0.421854","1506","Application Data [TCP segment of a reassembled PDU]"
"0.421855","1506","443  >  50638 [ACK] Seq=168170 Ack=2995 Win=347 Len=1452 [TCP segment of a reassembled PDU]"
"0.422844","1506","443  >  50638 [ACK] Seq=169622 Ack=2995 Win=347 Len=1452 [TCP segment of a reassembled PDU]"
"0.423073","1506","443  >  50638 [ACK] Seq=171074 Ack=2995 Win=347 Len=1452 [TCP segment of a reassembled PDU]"
"0.423074","1506","443  >  50638 [ACK] Seq=172526 Ack=2995 Win=347 Len=1452 [TCP segment of a reassembled PDU]"
"0.423075","1506","443  >  50638 [ACK] Seq=173978 Ack=2995 Win=347 Len=1452 [TCP segment of a reassembled PDU]"
"0.423076","1506","443  >  50638 [ACK] Seq=175430 Ack=2995 Win=347 Len=1452 [TCP segment of a reassembled PDU]"
"0.423849","1506","[TCP Previous segment not captured] , Ignored Unknown Record"
"0.424195","1506","Ignored Unknown Record"
"0.424299","1506","Ignored Unknown Record"
"0.424449","1506","Ignored Unknown Record"
"0.424485","1506","Ignored Unknown Record"
"0.424486","1506","Ignored Unknown Record"
"0.424487","1506","Ignored Unknown Record"
"0.426761","1506","Ignored Unknown Record"
"0.426762","1506","Ignored Unknown Record"
"0.426762","1506","Ignored Unknown Record"
"0.426764","1506","Ignored Unknown Record"
"0.426765","1506","Ignored Unknown Record"
"0.427343","1506","Ignored Unknown Record"
"0.427344","1506","Ignored Unknown Record"
"0.427345","1506","Ignored Unknown Record"
"0.427347","1506","Ignored Unknown Record"
"0.427348","1506","Ignored Unknown Record"
"0.427349","1506","Ignored Unknown Record"
"0.427992","1506","Ignored Unknown Record"
"0.427993","1506","Ignored Unknown Record"
"0.432537","1506","Ignored Unknown Record"
"0.432538","966","Ignored Unknown Record"
"0.432539","1506","Ignored Unknown Record"
"0.432544","1506","Ignored Unknown Record"
"0.432545","1506","Ignored Unknown Record"
"0.432546","1506","Ignored Unknown Record"
"0.433297","1506","443  >  50638 [ACK] Seq=226274 Ack=2995 Win=347 Len=1452"
"0.433299","1506","443  >  50638 [ACK] Seq=227726 Ack=2995 Win=347 Len=1452 [TCP segment of a reassembled PDU]"
"0.433299","1506","443  >  50638 [ACK] Seq=229178 Ack=2995 Win=347 Len=1452 [TCP segment of a reassembled PDU]"
"0.437311","1506","443  >  50638 [ACK] Seq=230630 Ack=2995 Win=347 Len=1452 [TCP segment of a reassembled PDU]"
"0.437312","1506","443  >  50638 [ACK] Seq=232082 Ack=2995 Win=347 Len=1452 [TCP segment of a reassembled PDU]"
"0.437423","1506","[TCP Previous segment not captured] , Ignored Unknown Record"
"0.437465","1506","Ignored Unknown Record"
"0.437466","1506","Ignored Unknown Record"
"0.437466","1506","Ignored Unknown Record"
"0.437467","1506","Ignored Unknown Record"
"0.438069","1506","Ignored Unknown Record"
"0.438070","1506","Ignored Unknown Record"
"0.438071","1506","Ignored Unknown Record"
"0.438073","618","Ignored Unknown Record"
"0.438073","1506","Ignored Unknown Record"
"0.438074","1506","Ignored Unknown Record"
"0.438075","1506","Ignored Unknown Record"
"0.438249","1506","Ignored Unknown Record"
"0.438250","1506","Ignored Unknown Record"
"0.438251","1506","Ignored Unknown Record"
"0.438252","1506","Ignored Unknown Record"
"0.438253","1506","Ignored Unknown Record"
"0.438254","1506","Ignored Unknown Record"
"0.438830","1506","Ignored Unknown Record"
"0.438831","1506","Ignored Unknown Record"
"0.438831","1506","Ignored Unknown Record"
"0.438833","1506","Ignored Unknown Record"
"0.440035","1506","Ignored Unknown Record"
"0.440036","1506","Ignored Unknown Record"
"0.440036","1506","Ignored Unknown Record"
"0.440203","1506","Ignored Unknown Record"
"0.441334","1506","Ignored Unknown Record"
"0.441435","1506","Ignored Unknown Record"
"0.441437","1506","Ignored Unknown Record"
"0.441438","1506","443  >  50638 [ACK] Seq=286370 Ack=2995 Win=347 Len=1452 [TCP segment of a reassembled PDU]"
"0.441438","1506","443  >  50638 [ACK] Seq=287822 Ack=2995 Win=347 Len=1452 [TCP segment of a reassembled PDU]"
"0.441439","966","443  >  50638 [PSH, ACK] Seq=289274 Ack=2995 Win=347 Len=912 [TCP segment of a reassembled PDU]"
"0.441529","1506","443  >  50638 [ACK] Seq=290186 Ack=2995 Win=347 Len=1452 [TCP segment of a reassembled PDU]"
"0.441530","1506","443  >  50638 [ACK] Seq=291638 Ack=2995 Win=347 Len=1452 [TCP segment of a reassembled PDU]"
"0.442106","1506","443  >  50638 [ACK] Seq=293090 Ack=2995 Win=347 Len=1452 [TCP segment of a reassembled PDU]"
"0.442107","1506","443  >  50638 [ACK] Seq=294542 Ack=2995 Win=347 Len=1452 [TCP segment of a reassembled PDU]"
"0.442249","1506","443  >  50638 [ACK] Seq=295994 Ack=2995 Win=347 Len=1452 [TCP segment of a reassembled PDU]"
"0.442251","1506","[TCP Fast Retransmission] 443  >  50638 [ACK] Seq=176882 Ack=2995 Win=347 Len=1452 [TCP segment of a reassembled PDU]"
"0.442743","1506","[TCP Out-Of-Order] 443  >  50638 [ACK] Seq=178334 Ack=2995 Win=347 Len=1452 [TCP segment of a reassembled PDU]"
"0.442931","1506","[TCP Out-Of-Order] 443  >  50638 [ACK] Seq=179786 Ack=2995 Win=347 Len=1452 [TCP segment of a reassembled PDU]"
"0.443082","1506","[TCP Out-Of-Order] 443  >  50638 [ACK] Seq=181238 Ack=2995 Win=347 Len=1452 [TCP segment of a reassembled PDU]"
"0.443084","1506","[TCP Out-Of-Order] 443  >  50638 [ACK] Seq=182690 Ack=2995 Win=347 Len=1452"
"0.443085","1506","[TCP Out-Of-Order] 443  >  50638 [ACK] Seq=184142 Ack=2995 Win=347 Len=1452"
"0.443086","1506","[TCP Out-Of-Order] 443  >  50638 [ACK] Seq=185594 Ack=2995 Win=347 Len=1452"
"0.443087","618","[TCP Out-Of-Order] 443  >  50638 [PSH, ACK] Seq=187046 Ack=2995 Win=347 Len=564"
"0.444436","1506","[TCP Out-Of-Order] 443  >  50638 [ACK] Seq=187610 Ack=2995 Win=347 Len=1452"
"0.444437","1506","443  >  50638 [ACK] Seq=297446 Ack=2995 Win=347 Len=1452 [TCP segment of a reassembled PDU]"
"0.444438","1506","443  >  50638 [ACK] Seq=298898 Ack=2995 Win=347 Len=1452 [TCP segment of a reassembled PDU]"
"0.444441","1506","443  >  50638 [ACK] Seq=300350 Ack=2995 Win=347 Len=1452 [TCP segment of a reassembled PDU]"
"0.444442","1506","443  >  50638 [ACK] Seq=301802 Ack=2995 Win=347 Len=1452 [TCP segment of a reassembled PDU]"
"0.448824","1506","443  >  50638 [ACK] Seq=303254 Ack=2995 Win=347 Len=1452 [TCP segment of a reassembled PDU]"
"0.448839","1506","443  >  50638 [ACK] Seq=304706 Ack=2995 Win=347 Len=1452 [TCP segment of a reassembled PDU]"
"0.448846","1506","443  >  50638 [ACK] Seq=306158 Ack=2995 Win=347 Len=1452 [TCP segment of a reassembled PDU]"
"0.448870","1506","443  >  50638 [ACK] Seq=307610 Ack=2995 Win=347 Len=1452 [TCP segment of a reassembled PDU]"
"0.448875","1506","443  >  50638 [ACK] Seq=309062 Ack=2995 Win=347 Len=1452 [TCP segment of a reassembled PDU]"
"0.448877","1506","443  >  50638 [ACK] Seq=310514 Ack=2995 Win=347 Len=1452 [TCP segment of a reassembled PDU]"
"0.448946","1506","443  >  50638 [ACK] Seq=311966 Ack=2995 Win=347 Len=1452 [TCP segment of a reassembled PDU]"
"0.448948","1506","443  >  50638 [ACK] Seq=313418 Ack=2995 Win=347 Len=1452 [TCP segment of a reassembled PDU]"
"0.448950","1506","[TCP Fast Retransmission] , Encrypted Heartbeat, Ignored Unknown Record"
"0.448951","1506","[TCP Out-Of-Order] 443  >  50638 [ACK] Seq=234986 Ack=2995 Win=347 Len=1452"
"0.450642","1506","[TCP Out-Of-Order] 443  >  50638 [ACK] Seq=236438 Ack=2995 Win=347 Len=1452"
"0.450645","1506","[TCP Out-Of-Order] 443  >  50638 [ACK] Seq=237890 Ack=2995 Win=347 Len=1452"
"0.450646","1506","[TCP Out-Of-Order] 443  >  50638 [ACK] Seq=239342 Ack=2995 Win=347 Len=1452"
"0.450648","1506","[TCP Out-Of-Order] 443  >  50638 [ACK] Seq=240794 Ack=2995 Win=347 Len=1452"
"0.450649","1506","[TCP Out-Of-Order] 443  >  50638 [ACK] Seq=242246 Ack=2995 Win=347 Len=1452"
"0.450650","1506","[TCP Out-Of-Order] 443  >  50638 [ACK] Seq=243698 Ack=2995 Win=347 Len=1452"
"0.450651","1506","443  >  50638 [ACK] Seq=314870 Ack=2995 Win=347 Len=1452 [TCP segment of a reassembled PDU]"
"0.451598","1506","443  >  50638 [ACK] Seq=316322 Ack=2995 Win=347 Len=1452 [TCP segment of a reassembled PDU]"
"0.451600","1506","Change Cipher Spec, Ignored Unknown Record"
"0.451601","1506","Ignored Unknown Record"
"0.451602","1506","Ignored Unknown Record"
"0.451603","1506","Ignored Unknown Record"
"0.451603","1506","Ignored Unknown Record"
"0.452900","1506","Ignored Unknown Record"
"0.452903","618","Ignored Unknown Record"
"0.452904","1506","Ignored Unknown Record"
"0.452905","1506","Ignored Unknown Record"
"0.452906","1506","Ignored Unknown Record"
"0.457182","1506","Ignored Unknown Record"
"0.457183","1506","Ignored Unknown Record"
"0.457184","1506","Ignored Unknown Record"
"0.457187","1506","Ignored Unknown Record"
"0.457187","1506","Ignored Unknown Record"
"0.457188","1506","Ignored Unknown Record"
"0.457189","1506","Ignored Unknown Record"
"0.457190","1506","Ignored Unknown Record"
"0.457191","1506","Ignored Unknown Record"
"0.457192","1506","Ignored Unknown Record"
"0.457451","1506","Ignored Unknown Record"
"0.457453","1506","Ignored Unknown Record"
"0.457454","1506","Ignored Unknown Record"
"0.457454","1506","Ignored Unknown Record"
"0.457455","1506","Ignored Unknown Record"
"0.457456","1506","Ignored Unknown Record"
"0.457457","1506","Ignored Unknown Record"
"0.457457","1506","Ignored Unknown Record"
"0.457458","1506","Ignored Unknown Record"
"0.457459","966","Ignored Unknown Record"
"0.459739","1506","Ignored Unknown Record"
"0.459740","1506","Ignored Unknown Record"
"0.459741","1506","Ignored Unknown Record"
"0.459742","1506","Ignored Unknown Record"
"0.459743","1506","Ignored Unknown Record"
"0.460069","1506","Ignored Unknown Record"
"0.460070","1506","Ignored Unknown Record"
"0.460352","1506","Ignored Unknown Record"
"0.460355","1506","Ignored Unknown Record"
"0.460355","1506","Ignored Unknown Record"
"0.461301","1506","Ignored Unknown Record"
"0.461409","1506","Ignored Unknown Record"
"0.462480","1506","Ignored Unknown Record"
"0.462486","1506","Ignored Unknown Record"
"0.462488","1506","Ignored Unknown Record"
"0.462491","1506","Ignored Unknown Record"
"0.462493","1506","Ignored Unknown Record"
"0.462495","1506","Ignored Unknown Record"
"0.462498","1506","Ignored Unknown Record"
"0.463446","1506","Ignored Unknown Record"
"0.463451","1506","Ignored Unknown Record"
"0.463455","1506","Ignored Unknown Record"
"0.463459","1506","Ignored Unknown Record"
"0.463465","1506","Ignored Unknown Record"
"0.464223","1506","Ignored Unknown Record"
"0.464231","618","Ignored Unknown Record"
"0.464238","1506","Ignored Unknown Record"
"0.465224","1506","Ignored Unknown Record"
"0.465226","1506","Ignored Unknown Record"
"0.465228","1506","Ignored Unknown Record"
"0.465373","1506","Ignored Unknown Record"
"0.472821","1506","Ignored Unknown Record"
"0.472822","1506","Ignored Unknown Record"
"0.472823","1506","443  >  50638 [ACK] Seq=406934 Ack=2995 Win=347 Len=1452"
"0.472826","1506","Ignored Unknown Record"
"0.472826","1506","Ignored Unknown Record"
"0.472827","1506","Ignored Unknown Record"
"0.472827","1506","Ignored Unknown Record"
"0.473250","1506","Ignored Unknown Record"
"0.473251","1506","Ignored Unknown Record"
"0.473252","1506","Ignored Unknown Record"
"0.473254","1506","Ignored Unknown Record"
"0.473255","1506","Ignored Unknown Record"
"0.473257","1506","Ignored Unknown Record"
"0.473257","1506","Ignored Unknown Record"
"0.473258","1506","Ignored Unknown Record"
"0.473259","1506","Ignored Unknown Record"
"0.473261","1506","Ignored Unknown Record"
"0.473633","966","Ignored Unknown Record"
"0.473634","1506","443  >  50638 [ACK] Seq=429626 Ack=2995 Win=347 Len=1452"
"0.473635","1506","Ignored Unknown Record"
"0.473636","1506","Ignored Unknown Record"
"0.473637","1506","Ignored Unknown Record"
"0.473637","1506","Ignored Unknown Record"
"0.473638","1506","443  >  50638 [ACK] Seq=436886 Ack=2995 Win=347 Len=1452 [TCP segment of a reassembled PDU]"
"0.473639","1506","443  >  50638 [ACK] Seq=438338 Ack=2995 Win=347 Len=1452 [TCP segment of a reassembled PDU]"
"0.473640","1506","443  >  50638 [ACK] Seq=439790 Ack=2995 Win=347 Len=1452 [TCP segment of a reassembled PDU]"
"0.474212","1506","443  >  50638 [ACK] Seq=441242 Ack=2995 Win=347 Len=1452 [TCP segment of a reassembled PDU]"
"0.474729","1506","443  >  50638 [ACK] Seq=442694 Ack=2995 Win=347 Len=1452 [TCP segment of a reassembled PDU]"
"0.474812","1506","443  >  50638 [ACK] Seq=444146 Ack=2995 Win=347 Len=1452 [TCP segment of a reassembled PDU]"
"0.475486","1506","443  >  50638 [ACK] Seq=445598 Ack=2995 Win=347 Len=1452 [TCP segment of a reassembled PDU]"
"0.475487","1506","443  >  50638 [ACK] Seq=447050 Ack=2995 Win=347 Len=1452 [TCP segment of a reassembled PDU]"
"0.475488","1506","443  >  50638 [ACK] Seq=448502 Ack=2995 Win=347 Len=1452 [TCP segment of a reassembled PDU]"
"0.475490","1506","443  >  50638 [ACK] Seq=449954 Ack=2995 Win=347 Len=1452 [TCP segment of a reassembled PDU]"
"0.475490","1506","Encrypted Alert, Ignored Unknown Record"
"0.477091","1506","Ignored Unknown Record"
"0.477093","1506","Ignored Unknown Record"
"0.477094","1506","Ignored Unknown Record"
"0.477097","1506","Ignored Unknown Record"
"0.477098","1506","Ignored Unknown Record"
"0.477099","1506","Ignored Unknown Record"
"0.477100","1506","Ignored Unknown Record"
"0.477100","1506","Ignored Unknown Record"
"0.477101","1506","Ignored Unknown Record"
"0.477102","618","Ignored Unknown Record"
"0.478071","1506","Ignored Unknown Record"
"0.478072","1506","Ignored Unknown Record"
"0.478073","1506","Ignored Unknown Record"
"0.478074","1506","Ignored Unknown Record"
"0.479329","1506","Ignored Unknown Record"
"0.479336","1506","Ignored Unknown Record"
"0.479343","1506","Ignored Unknown Record"
"0.480963","1506","Ignored Unknown Record"
"0.483320","1506","Ignored Unknown Record"
"0.483322","1506","Ignored Unknown Record"
"0.483323","1506","Ignored Unknown Record"
"0.483324","1506","Ignored Unknown Record"
"0.483326","1506","Ignored Unknown Record"
"0.483327","1506","Ignored Unknown Record"
"0.483329","1506","Ignored Unknown Record"
"0.483331","1506","Ignored Unknown Record"
"0.483332","1506","Ignored Unknown Record"
"0.483333","1506","Ignored Unknown Record"
"0.483940","1506","Ignored Unknown Record"
"0.483941","1506","Ignored Unknown Record"
"0.487148","1506","Ignored Unknown Record"
"0.487149","1506","Ignored Unknown Record"
"0.487151","966","Ignored Unknown Record"
"0.488367","1506","443  >  50638 [ACK] Seq=499346 Ack=2995 Win=347 Len=1452"
"0.488369","1506","Ignored Unknown Record"
"0.488371","1506","Ignored Unknown Record"
"0.488372","1506","Ignored Unknown Record"
"0.488373","1506","Ignored Unknown Record"
"0.488933","1506","Ignored Unknown Record"
"0.488936","1506","Ignored Unknown Record"
"0.489885","1506","[TCP Previous segment not captured] , Ignored Unknown Record"
"0.489887","1506","Ignored Unknown Record"
"0.489888","1506","Ignored Unknown Record"
"0.489891","1506","Ignored Unknown Record"
"0.489892","1506","Ignored Unknown Record"
"0.489893","1506","Ignored Unknown Record"
"0.489896","1506","Ignored Unknown Record"
"0.489898","1506","Ignored Unknown Record"
"0.490155","1506","Ignored Unknown Record"
"0.490156","618","Ignored Unknown Record"
"0.490787","1506","Ignored Unknown Record"
"0.490952","1506","443  >  50638 [ACK] Seq=537662 Ack=2995 Win=347 Len=1452"
"0.491059","1506","Ignored Unknown Record"
"0.491060","1506","Ignored Unknown Record"
"0.491062","1506","Ignored Unknown Record"
"0.491715","1506","Ignored Unknown Record"
"0.492236","1506","Ignored Unknown Record"
"0.492371","1506","Ignored Unknown Record"
"0.492374","1506","Ignored Unknown Record"
"0.492553","1506","Ignored Unknown Record"
"0.492593","1506","Ignored Unknown Record"
"0.492594","1506","Ignored Unknown Record"
"0.492596","1506","Ignored Unknown Record"
"0.493133","1506","Ignored Unknown Record"
"0.496075","1506","Ignored Unknown Record"
"0.496084","1506","Ignored Unknown Record"
"0.496105","1506","Ignored Unknown Record"
"0.496111","1506","Ignored Unknown Record"
"0.496117","1506","Ignored Unknown Record"
"0.496126","1506","Ignored Unknown Record"
"0.496134","1506","Ignored Unknown Record"
"0.496140","1506","Ignored Unknown Record"
"0.496144","966","Ignored Unknown Record"
"0.496145","1506","Ignored Unknown Record"
"0.497975","1506","Ignored Unknown Record"
"0.497976","1506","Ignored Unknown Record"
"0.497978","1506","Ignored Unknown Record"
"0.497979","1506","Ignored Unknown Record"
"0.497980","1506","Ignored Unknown Record"
"0.497981","1506","Ignored Unknown Record"
"0.497983","1506","Ignored Unknown Record"
"0.498502","1506","Ignored Unknown Record"
"0.498509","1506","Ignored Unknown Record"
"0.502155","1506","Ignored Unknown Record"
"0.502157","1506","Ignored Unknown Record"
"0.502158","1506","Ignored Unknown Record"
"0.502159","1506","Ignored Unknown Record"
"0.503122","1506","443  >  50638 [ACK] Seq=589394 Ack=2995 Win=347 Len=1452 [TCP segment of a reassembled PDU]"
"0.503123","1506","443  >  50638 [ACK] Seq=590846 Ack=2995 Win=347 Len=1452 [TCP segment of a reassembled PDU]"
"0.503123","1506","443  >  50638 [ACK] Seq=592298 Ack=2995 Win=347 Len=1452 [TCP segment of a reassembled PDU]"
"0.503125","1506","443  >  50638 [ACK] Seq=593750 Ack=2995 Win=347 Len=1452 [TCP segment of a reassembled PDU]"
"0.503126","1506","443  >  50638 [ACK] Seq=595202 Ack=2995 Win=347 Len=1452 [TCP segment of a reassembled PDU]"
"0.503127","1506","[TCP Previous segment not captured] 443  >  50638 [ACK] Seq=608834 Ack=2995 Win=347 Len=1452 [TCP segment of a reassembled PDU]"
"0.503127","1506","443  >  50638 [ACK] Seq=610286 Ack=2995 Win=347 Len=1452 [TCP segment of a reassembled PDU]"
"0.504943","1506","443  >  50638 [ACK] Seq=611738 Ack=2995 Win=347 Len=1452 [TCP segment of a reassembled PDU]"
"0.504944","1506","443  >  50638 [ACK] Seq=613190 Ack=2995 Win=347 Len=1452 [TCP segment of a reassembled PDU]"
"0.504945","1506","443  >  50638 [ACK] Seq=614642 Ack=2995 Win=347 Len=1452 [TCP segment of a reassembled PDU]"
"0.504947","1506","443  >  50638 [ACK] Seq=616094 Ack=2995 Win=347 Len=1452 [TCP segment of a reassembled PDU]"
"0.504947","1506","443  >  50638 [ACK] Seq=617546 Ack=2995 Win=347 Len=1452 [TCP segment of a reassembled PDU]"
"0.504948","1506","443  >  50638 [ACK] Seq=618998 Ack=2995 Win=347 Len=1452 [TCP segment of a reassembled PDU]"
"0.504949","1506","443  >  50638 [ACK] Seq=620450 Ack=2995 Win=347 Len=1452 [TCP segment of a reassembled PDU]"
"0.505950","1506","443  >  50638 [ACK] Seq=621902 Ack=2995 Win=347 Len=1452 [TCP segment of a reassembled PDU]"
"0.505950","1506","443  >  50638 [ACK] Seq=623354 Ack=2995 Win=347 Len=1452 [TCP segment of a reassembled PDU]"
"0.505951","1506","443  >  50638 [ACK] Seq=624806 Ack=2995 Win=347 Len=1452 [TCP segment of a reassembled PDU]"
"0.505953","1506","443  >  50638 [ACK] Seq=626258 Ack=2995 Win=347 Len=1452 [TCP segment of a reassembled PDU]"
"0.505954","1506","443  >  50638 [ACK] Seq=627710 Ack=2995 Win=347 Len=1452 [TCP segment of a reassembled PDU], Ignored Unknown Record"
"0.505954","1506","Ignored Unknown Record"
"0.506872","1506","Ignored Unknown Record"
"0.506873","1506","Ignored Unknown Record"
"0.506873","1506","Ignored Unknown Record"
"0.508086","1506","443  >  50638 [ACK] Seq=634970 Ack=2995 Win=347 Len=1452 [TCP segment of a reassembled PDU]"
"0.508087","1506","443  >  50638 [ACK] Seq=636422 Ack=2995 Win=347 Len=1452 [TCP segment of a reassembled PDU]"
"0.508088","966","443  >  50638 [PSH, ACK] Seq=637874 Ack=2995 Win=347 Len=912 [TCP segment of a reassembled PDU]"
"0.508089","1506","443  >  50638 [ACK] Seq=638786 Ack=2995 Win=347 Len=1452 [TCP segment of a reassembled PDU]"
"0.508778","1506","443  >  50638 [ACK] Seq=640238 Ack=2995 Win=347 Len=1452 [TCP segment of a reassembled PDU]"
"0.508780","1506","443  >  50638 [ACK] Seq=641690 Ack=2995 Win=347 Len=1452 [TCP segment of a reassembled PDU]"
"0.508781","1506","443  >  50638 [ACK] Seq=643142 Ack=2995 Win=347 Len=1452 [TCP segment of a reassembled PDU]"
"0.508783","1506","443  >  50638 [ACK] Seq=644594 Ack=2995 Win=347 Len=1452 [TCP segment of a reassembled PDU]"
"0.509521","1506","443  >  50638 [ACK] Seq=646046 Ack=2995 Win=347 Len=1452 [TCP segment of a reassembled PDU]"
"0.510249","1506","443  >  50638 [ACK] Seq=647498 Ack=2995 Win=347 Len=1452 [TCP segment of a reassembled PDU]"
"0.512549","1506","443  >  50638 [ACK] Seq=648950 Ack=2995 Win=347 Len=1452 [TCP segment of a reassembled PDU]"
"0.512563","1506","[TCP Fast Retransmission] , Ignored Unknown Record"
"0.512570","1506","[TCP Out-Of-Order] 443  >  50638 [ACK] Seq=510962 Ack=2995 Win=347 Len=1452"
"0.512576","1506","[TCP Out-Of-Order] 443  >  50638 [ACK] Seq=512414 Ack=2995 Win=347 Len=1452"
"0.512580","1506","[TCP Out-Of-Order] 443  >  50638 [ACK] Seq=513866 Ack=2995 Win=347 Len=1452"
"0.512586","1506","[TCP Out-Of-Order] 443  >  50638 [ACK] Seq=515318 Ack=2995 Win=347 Len=1452"
"0.512592","1506","[TCP Out-Of-Order] 443  >  50638 [ACK] Seq=516770 Ack=2995 Win=347 Len=1452"
"0.512594","1506","[TCP Out-Of-Order] 443  >  50638 [ACK] Seq=518222 Ack=2995 Win=347 Len=1452"
"0.512598","1506","[TCP Out-Of-Order] 443  >  50638 [ACK] Seq=519674 Ack=2995 Win=347 Len=1452"
"0.512604","1506","[TCP Out-Of-Order] 443  >  50638 [ACK] Seq=521126 Ack=2995 Win=347 Len=1452"
"0.516422","1506","443  >  50638 [ACK] Seq=650402 Ack=2995 Win=347 Len=1452 [TCP segment of a reassembled PDU]"
"0.516426","1506","443  >  50638 [ACK] Seq=651854 Ack=2995 Win=347 Len=1452 [TCP segment of a reassembled PDU]"
"0.516432","1506","443  >  50638 [ACK] Seq=653306 Ack=2995 Win=347 Len=1452 [TCP segment of a reassembled PDU]"
"0.516435","1506","443  >  50638 [ACK] Seq=654758 Ack=2995 Win=347 Len=1452 [TCP segment of a reassembled PDU]"
"0.516438","1506","443  >  50638 [ACK] Seq=656210 Ack=2995 Win=347 Len=1452 [TCP segment of a reassembled PDU]"
"0.516440","1506","443  >  50638 [ACK] Seq=657662 Ack=2995 Win=347 Len=1452 [TCP segment of a reassembled PDU]"
"0.516442","1506","443  >  50638 [ACK] Seq=659114 Ack=2995 Win=347 Len=1452 [TCP segment of a reassembled PDU]"
"0.516446","1506","443  >  50638 [ACK] Seq=660566 Ack=2995 Win=347 Len=1452 [TCP segment of a reassembled PDU]"
"0.516449","1506","443  >  50638 [ACK] Seq=662018 Ack=2995 Win=347 Len=1452 [TCP segment of a reassembled PDU]"
"0.517333","1506","443  >  50638 [ACK] Seq=663470 Ack=2995 Win=347 Len=1452 [TCP segment of a reassembled PDU]"
"0.517335","1506","443  >  50638 [ACK] Seq=664922 Ack=2995 Win=347 Len=1452 [TCP segment of a reassembled PDU]"
"0.517336","1506","Application Data, Ignored Unknown Record"
"0.517337","1506","Ignored Unknown Record"
"0.517338","1506","Ignored Unknown Record"
"0.517339","1506","Ignored Unknown Record"
"0.517340","1506","Ignored Unknown Record"
"0.517341","1506","Ignored Unknown Record"
"0.517342","618","Ignored Unknown Record"
"0.517343","1506","Ignored Unknown Record"
"0.517787","1506","Ignored Unknown Record"
"0.517788","1506","Ignored Unknown Record"
"0.517789","1506","Ignored Unknown Record"
"0.517790","1506","Ignored Unknown Record"
"0.517888","1506","Ignored Unknown Record"
"0.518610","1506","Ignored Unknown Record"
"0.518612","1506","Ignored Unknown Record"
"0.518615","1506","Ignored Unknown Record"
"0.519213","1506","Ignored Unknown Record"
"0.520285","1506","Ignored Unknown Record"
"0.520685","1506","Ignored Unknown Record"
"0.520724","1506","Ignored Unknown Record"
"0.520795","1506","Ignored Unknown Record"
"0.520796","1506","[TCP Previous segment not captured] , Ignored Unknown Record"
"0.520891","1506","Ignored Unknown Record"
"0.520973","1506","Ignored Unknown Record"
"0.520973","1506","Ignored Unknown Record"
"0.520975","1506","Ignored Unknown Record"
"0.520976","1506","443  >  50638 [ACK] Seq=704690 Ack=2995 Win=347 Len=1452 [TCP segment of a reassembled PDU]"
"0.522069","1506","443  >  50638 [ACK] Seq=706142 Ack=2995 Win=347 Len=1452 [TCP segment of a reassembled PDU]"
"0.522070","966","443  >  50638 [PSH, ACK] Seq=707594 Ack=2995 Win=347 Len=912 [TCP segment of a reassembled PDU]"
"0.522070","1506","443  >  50638 [ACK] Seq=708506 Ack=2995 Win=347 Len=1452 [TCP segment of a reassembled PDU]"
"0.522071","1506","[TCP Fast Retransmission] 443  >  50638 [ACK] Seq=596654 Ack=2995 Win=347 Len=1452 [TCP segment of a reassembled PDU]"
"0.522072","1506","[TCP Out-Of-Order] 443  >  50638 [ACK] Seq=598106 Ack=2995 Win=347 Len=1452 [TCP segment of a reassembled PDU]"
"0.522663","1506","[TCP Out-Of-Order] 443  >  50638 [ACK] Seq=599558 Ack=2995 Win=347 Len=1452 [TCP segment of a reassembled PDU]"
"0.522664","1506","[TCP Out-Of-Order] 443  >  50638 [ACK] Seq=601010 Ack=2995 Win=347 Len=1452 [TCP segment of a reassembled PDU]"
"0.522818","1506","[TCP Out-Of-Order] 443  >  50638 [ACK] Seq=602462 Ack=2995 Win=347 Len=1452 [TCP segment of a reassembled PDU]"
"0.522820","1506","[TCP Out-Of-Order] 443  >  50638 [ACK] Seq=603914 Ack=2995 Win=347 Len=1452 [TCP segment of a reassembled PDU]"
"0.522820","618","[TCP Out-Of-Order] 443  >  50638 [PSH, ACK] Seq=605366 Ack=2995 Win=347 Len=564 [TCP segment of a reassembled PDU]"
"0.524250","1506","[TCP Out-Of-Order] 443  >  50638 [ACK] Seq=607382 Ack=2995 Win=347 Len=1452 [TCP segment of a reassembled PDU]"
"0.524251","1506","443  >  50638 [ACK] Seq=709958 Ack=2995 Win=347 Len=1452 [TCP segment of a reassembled PDU]"
"0.524252","1506","443  >  50638 [ACK] Seq=711410 Ack=2995 Win=347 Len=1452 [TCP segment of a reassembled PDU]"
"0.524256","1506","443  >  50638 [ACK] Seq=712862 Ack=2995 Win=347 Len=1452 [TCP segment of a reassembled PDU]"
"0.524257","1506","443  >  50638 [ACK] Seq=714314 Ack=2995 Win=347 Len=1452 [TCP segment of a reassembled PDU]"
"0.525944","1506","443  >  50638 [ACK] Seq=715766 Ack=2995 Win=347 Len=1452 [TCP segment of a reassembled PDU]"
"0.526080","1506","443  >  50638 [ACK] Seq=717218 Ack=2995 Win=347 Len=1452 [TCP segment of a reassembled PDU]"
"0.526081","1506","443  >  50638 [ACK] Seq=718670 Ack=2995 Win=347 Len=1452 [TCP segment of a reassembled PDU]"
"0.526083","1506","443  >  50638 [ACK] Seq=720122 Ack=2995 Win=347 Len=1452 [TCP segment of a reassembled PDU]"
"0.526166","1506","443  >  50638 [ACK] Seq=721574 Ack=2995 Win=347 Len=1452 [TCP segment of a reassembled PDU]"
"0.526699","1506","[TCP Previous segment not captured] 443  >  50638 [ACK] Seq=724478 Ack=2995 Win=347 Len=1452 [TCP segment of a reassembled PDU]"
"0.526820","1506","443  >  50638 [ACK] Seq=725930 Ack=2995 Win=347 Len=1452 [TCP segment of a reassembled PDU]"
"0.527144","1506","443  >  50638 [ACK] Seq=727382 Ack=2995 Win=347 Len=1452 [TCP segment of a reassembled PDU]"
"0.527145","1506","443  >  50638 [ACK] Seq=728834 Ack=2995 Win=347 Len=1452 [TCP segment of a reassembled PDU]"
"0.527146","1506","443  >  50638 [ACK] Seq=730286 Ack=2995 Win=347 Len=1452 [TCP segment of a reassembled PDU]"
"0.527147","1506","443  >  50638 [ACK] Seq=731738 Ack=2995 Win=347 Len=1452 [TCP segment of a reassembled PDU]"
"0.527148","1506","443  >  50638 [ACK] Seq=733190 Ack=2995 Win=347 Len=1452 [TCP segment of a reassembled PDU]"
"0.527724","1506","443  >  50638 [ACK] Seq=734642 Ack=2995 Win=347 Len=1452 [TCP segment of a reassembled PDU]"
"0.527725","1506","[TCP Previous segment not captured] 443  >  50638 [ACK] Seq=737546 Ack=2995 Win=347 Len=1452 [TCP segment of a reassembled PDU]"
"0.527725","1506","443  >  50638 [ACK] Seq=738998 Ack=2995 Win=347 Len=1452 [TCP segment of a reassembled PDU]"
